ISO,datatype,rcsi_people,rcsi_prevalence,method,date,year,month,day,i,rCSI_monthly,biweek,rCSI_biweekly,wb_region,incgrp,country
AFG,SURVEY,4707605,11.649067,Survey,13/06/21,2021,6,13,AFG,12.1441,1,11.686932,South Asia,Low income,Afghanistan
AFG,SURVEY,4738208,11.724797,Survey,14/06/21,2021,6,14,AFG,12.1441,1,11.686932,South Asia,Low income,Afghanistan
AFG,SURVEY,4700409,11.631262,Survey,15/06/21,2021,6,15,AFG,12.1441,2,12.201246,South Asia,Low income,Afghanistan
AFG,SURVEY,4703482,11.638865,Survey,16/06/21,2021,6,16,AFG,12.1441,2,12.201246,South Asia,Low income,Afghanistan
AFG,SURVEY,4780570,11.829621,Survey,17/06/21,2021,6,17,AFG,12.1441,2,12.201246,South Asia,Low income,Afghanistan
AFG,SURVEY,4597626,11.376923,Survey,18/06/21,2021,6,18,AFG,12.1441,2,12.201246,South Asia,Low income,Afghanistan
AFG,SURVEY,4620554,11.433659,Survey,19/06/21,2021,6,19,AFG,12.1441,2,12.201246,South Asia,Low income,Afghanistan
AFG,SURVEY,4632806,11.46398,Survey,20/06/21,2021,6,20,AFG,12.1441,2,12.201246,South Asia,Low income,Afghanistan
AFG,SURVEY,4749692,11.753214,Survey,21/06/21,2021,6,21,AFG,12.1441,2,12.201246,South Asia,Low income,Afghanistan
AFG,SURVEY,4870444,12.052017,Survey,22/06/21,2021,6,22,AFG,12.1441,2,12.201246,South Asia,Low income,Afghanistan
AFG,SURVEY,4991102,12.350588,Survey,23/06/21,2021,6,23,AFG,12.1441,2,12.201246,South Asia,Low income,Afghanistan
AFG,SURVEY,4994829,12.359812,Survey,24/06/21,2021,6,24,AFG,12.1441,2,12.201246,South Asia,Low income,Afghanistan
AFG,SURVEY,4782225,11.833717,Survey,25/06/21,2021,6,25,AFG,12.1441,2,12.201246,South Asia,Low income,Afghanistan
AFG,SURVEY,5224634,12.928468,Survey,26/06/21,2021,6,26,AFG,12.1441,2,12.201246,South Asia,Low income,Afghanistan
AFG,SURVEY,4963962,12.28343,Survey,27/06/21,2021,6,27,AFG,12.1441,2,12.201246,South Asia,Low income,Afghanistan
AFG,SURVEY,5451337,13.489448,Survey,28/06/21,2021,6,28,AFG,12.1441,2,12.201246,South Asia,Low income,Afghanistan
AFG,SURVEY,5442263,13.466997,Survey,29/06/21,2021,6,29,AFG,12.1441,2,12.201246,South Asia,Low income,Afghanistan
AFG,SURVEY,5386069,13.327943,Survey,30/06/21,2021,6,30,AFG,12.1441,2,12.201246,South Asia,Low income,Afghanistan
AFG,SURVEY,5296262,13.105711,Survey,01/07/21,2021,7,1,AFG,9.9845552,1,10.315085,South Asia,Low income,Afghanistan
AFG,SURVEY,4802713,11.884415,Survey,02/07/21,2021,7,2,AFG,9.9845552,1,10.315085,South Asia,Low income,Afghanistan
AFG,SURVEY,4101782,10.149947,Survey,03/07/21,2021,7,3,AFG,9.9845552,1,10.315085,South Asia,Low income,Afghanistan
AFG,SURVEY,3939710,9.7488966,Survey,04/07/21,2021,7,4,AFG,9.9845552,1,10.315085,South Asia,Low income,Afghanistan
AFG,SURVEY,4062201,10.052003,Survey,05/07/21,2021,7,5,AFG,9.9845552,1,10.315085,South Asia,Low income,Afghanistan
AFG,SURVEY,4065653,10.060546,Survey,06/07/21,2021,7,6,AFG,9.9845552,1,10.315085,South Asia,Low income,Afghanistan
AFG,SURVEY,4103566,10.154361,Survey,07/07/21,2021,7,7,AFG,9.9845552,1,10.315085,South Asia,Low income,Afghanistan
AFG,SURVEY,3945168,9.7624016,Survey,08/07/21,2021,7,8,AFG,9.9845552,1,10.315085,South Asia,Low income,Afghanistan
AFG,SURVEY,3855404,9.5402794,Survey,09/07/21,2021,7,9,AFG,9.9845552,1,10.315085,South Asia,Low income,Afghanistan
AFG,SURVEY,3901410,9.6541214,Survey,10/07/21,2021,7,10,AFG,9.9845552,1,10.315085,South Asia,Low income,Afghanistan
AFG,SURVEY,4232515,10.473447,Survey,11/07/21,2021,7,11,AFG,9.9845552,1,10.315085,South Asia,Low income,Afghanistan
AFG,SURVEY,4068658,10.067981,Survey,12/07/21,2021,7,12,AFG,9.9845552,1,10.315085,South Asia,Low income,Afghanistan
AFG,SURVEY,4005499,9.9116917,Survey,13/07/21,2021,7,13,AFG,9.9845552,1,10.315085,South Asia,Low income,Afghanistan
AFG,SURVEY,3978707,9.8453951,Survey,14/07/21,2021,7,14,AFG,9.9845552,1,10.315085,South Asia,Low income,Afghanistan
AFG,SURVEY,3882669,9.6077461,Survey,15/07/21,2021,7,15,AFG,9.9845552,2,9.7123537,South Asia,Low income,Afghanistan
AFG,SURVEY,4178646,10.340149,Survey,16/07/21,2021,7,16,AFG,9.9845552,2,9.7123537,South Asia,Low income,Afghanistan
AFG,SURVEY,4230795,10.469194,Survey,17/07/21,2021,7,17,AFG,9.9845552,2,9.7123537,South Asia,Low income,Afghanistan
AFG,SURVEY,4274602,10.577595,Survey,18/07/21,2021,7,18,AFG,9.9845552,2,9.7123537,South Asia,Low income,Afghanistan
AFG,SURVEY,3999944,9.8979473,Survey,19/07/21,2021,7,19,AFG,9.9845552,2,9.7123537,South Asia,Low income,Afghanistan
AFG,SURVEY,4035379,9.9856319,Survey,20/07/21,2021,7,20,AFG,9.9845552,2,9.7123537,South Asia,Low income,Afghanistan
AFG,SURVEY,3959068,9.7967987,Survey,21/07/21,2021,7,21,AFG,9.9845552,2,9.7123537,South Asia,Low income,Afghanistan
AFG,SURVEY,3927550,9.7188044,Survey,22/07/21,2021,7,22,AFG,9.9845552,2,9.7123537,South Asia,Low income,Afghanistan
AFG,SURVEY,3919604,9.6991425,Survey,23/07/21,2021,7,23,AFG,9.9845552,2,9.7123537,South Asia,Low income,Afghanistan
AFG,SURVEY,3635082,8.9950876,Survey,24/07/21,2021,7,24,AFG,9.9845552,2,9.7123537,South Asia,Low income,Afghanistan
AFG,SURVEY,3700136,9.156065,Survey,25/07/21,2021,7,25,AFG,9.9845552,2,9.7123537,South Asia,Low income,Afghanistan
AFG,SURVEY,3580947,8.8611288,Survey,26/07/21,2021,7,26,AFG,9.9845552,2,9.7123537,South Asia,Low income,Afghanistan
AFG,SURVEY,3562606,8.8157434,Survey,27/07/21,2021,7,27,AFG,9.9845552,2,9.7123537,South Asia,Low income,Afghanistan
AFG,SURVEY,3551363,8.7879229,Survey,28/07/21,2021,7,28,AFG,9.9845552,2,9.7123537,South Asia,Low income,Afghanistan
AFG,SURVEY,3735588,9.2437925,Survey,29/07/21,2021,7,29,AFG,9.9845552,2,9.7123537,South Asia,Low income,Afghanistan
AFG,SURVEY,4127473,10.21352,Survey,30/07/21,2021,7,30,AFG,9.9845552,2,9.7123537,South Asia,Low income,Afghanistan
AFG,SURVEY,4422572,10.943747,Survey,31/07/21,2021,7,31,AFG,9.9845552,2,9.7123537,South Asia,Low income,Afghanistan
AFG,SURVEY,4371206,10.816642,Survey,01/08/21,2021,8,1,AFG,12.094986,1,10.85993,South Asia,Low income,Afghanistan
AFG,SURVEY,4770338,11.804303,Survey,02/08/21,2021,8,2,AFG,12.094986,1,10.85993,South Asia,Low income,Afghanistan
AFG,SURVEY,4820747,11.92904,Survey,03/08/21,2021,8,3,AFG,12.094986,1,10.85993,South Asia,Low income,Afghanistan
AFG,SURVEY,4657044,11.523952,Survey,04/08/21,2021,8,4,AFG,12.094986,1,10.85993,South Asia,Low income,Afghanistan
AFG,SURVEY,4801636,11.881748,Survey,05/08/21,2021,8,5,AFG,12.094986,1,10.85993,South Asia,Low income,Afghanistan
AFG,SURVEY,4446600,11.003205,Survey,06/08/21,2021,8,6,AFG,12.094986,1,10.85993,South Asia,Low income,Afghanistan
AFG,SURVEY,4305759,10.654692,Survey,07/08/21,2021,8,7,AFG,12.094986,1,10.85993,South Asia,Low income,Afghanistan
AFG,SURVEY,4302447,10.646495,Survey,08/08/21,2021,8,8,AFG,12.094986,1,10.85993,South Asia,Low income,Afghanistan
AFG,SURVEY,4305456,10.653941,Survey,09/08/21,2021,8,9,AFG,12.094986,1,10.85993,South Asia,Low income,Afghanistan
AFG,SURVEY,4294697,10.627318,Survey,10/08/21,2021,8,10,AFG,12.094986,1,10.85993,South Asia,Low income,Afghanistan
AFG,SURVEY,4319698,10.689184,Survey,11/08/21,2021,8,11,AFG,12.094986,1,10.85993,South Asia,Low income,Afghanistan
AFG,SURVEY,4180548,10.344854,Survey,12/08/21,2021,8,12,AFG,12.094986,1,10.85993,South Asia,Low income,Afghanistan
AFG,SURVEY,3997634,9.89223,Survey,13/08/21,2021,8,13,AFG,12.094986,1,10.85993,South Asia,Low income,Afghanistan
AFG,SURVEY,3867990,9.5714216,Survey,14/08/21,2021,8,14,AFG,12.094986,1,10.85993,South Asia,Low income,Afghanistan
AFG,SURVEY,4185280,10.356563,Survey,15/08/21,2021,8,15,AFG,12.094986,2,13.11209,South Asia,Low income,Afghanistan
AFG,SURVEY,4132000,10.224722,Survey,16/08/21,2021,8,16,AFG,12.094986,2,13.11209,South Asia,Low income,Afghanistan
AFG,SURVEY,3995353,9.8865862,Survey,17/08/21,2021,8,17,AFG,12.094986,2,13.11209,South Asia,Low income,Afghanistan
AFG,SURVEY,4142560,10.250853,Survey,18/08/21,2021,8,18,AFG,12.094986,2,13.11209,South Asia,Low income,Afghanistan
AFG,SURVEY,4417761,10.931845,Survey,19/08/21,2021,8,19,AFG,12.094986,2,13.11209,South Asia,Low income,Afghanistan
AFG,SURVEY,4417761,10.931845,Survey,20/08/21,2021,8,20,AFG,12.094986,2,13.11209,South Asia,Low income,Afghanistan
AFG,SURVEY,4417761,10.931845,Survey,21/08/21,2021,8,21,AFG,12.094986,2,13.11209,South Asia,Low income,Afghanistan
AFG,SURVEY,4417761,10.931845,Survey,22/08/21,2021,8,22,AFG,12.094986,2,13.11209,South Asia,Low income,Afghanistan
AFG,SURVEY,4417761,10.931845,Survey,23/08/21,2021,8,23,AFG,12.094986,2,13.11209,South Asia,Low income,Afghanistan
AFG,SURVEY,4414093,10.922767,Survey,24/08/21,2021,8,24,AFG,12.094986,2,13.11209,South Asia,Low income,Afghanistan
AFG,SURVEY,5277163,13.058453,Survey,25/08/21,2021,8,25,AFG,12.094986,2,13.11209,South Asia,Low income,Afghanistan
AFG,SURVEY,6081287,15.048273,Survey,26/08/21,2021,8,26,AFG,12.094986,2,13.11209,South Asia,Low income,Afghanistan
AFG,SURVEY,6231371,15.419659,Survey,27/08/21,2021,8,27,AFG,12.094986,2,13.11209,South Asia,Low income,Afghanistan
AFG,SURVEY,6677781,16.524311,Survey,28/08/21,2021,8,28,AFG,12.094986,2,13.11209,South Asia,Low income,Afghanistan
AFG,SURVEY,7134735,17.655048,Survey,29/08/21,2021,8,29,AFG,12.094986,2,13.11209,South Asia,Low income,Afghanistan
AFG,SURVEY,7799347,19.299648,Survey,30/08/21,2021,8,30,AFG,12.094986,2,13.11209,South Asia,Low income,Afghanistan
AFG,SURVEY,7920492,19.599426,Survey,31/08/21,2021,8,31,AFG,12.094986,2,13.11209,South Asia,Low income,Afghanistan
AFG,SURVEY,8329929,20.612585,Survey,01/09/21,2021,9,1,AFG,36.080784,1,33.339249,South Asia,Low income,Afghanistan
AFG,SURVEY,9272170,22.944181,Survey,02/09/21,2021,9,2,AFG,36.080784,1,33.339249,South Asia,Low income,Afghanistan
AFG,SURVEY,10930338,27.047354,Survey,03/09/21,2021,9,3,AFG,36.080784,1,33.339249,South Asia,Low income,Afghanistan
AFG,SURVEY,11622947,28.761223,Survey,04/09/21,2021,9,4,AFG,36.080784,1,33.339249,South Asia,Low income,Afghanistan
AFG,SURVEY,12300587,30.438063,Survey,05/09/21,2021,9,5,AFG,36.080784,1,33.339249,South Asia,Low income,Afghanistan
AFG,SURVEY,13133903,32.500122,Survey,06/09/21,2021,9,6,AFG,36.080784,1,33.339249,South Asia,Low income,Afghanistan
AFG,SURVEY,13576844,33.596188,Survey,07/09/21,2021,9,7,AFG,36.080784,1,33.339249,South Asia,Low income,Afghanistan
AFG,SURVEY,13717304,33.943756,Survey,08/09/21,2021,9,8,AFG,36.080784,1,33.339249,South Asia,Low income,Afghanistan
AFG,SURVEY,14957456,37.012535,Survey,09/09/21,2021,9,9,AFG,36.080784,1,33.339249,South Asia,Low income,Afghanistan
AFG,SURVEY,15567687,38.522572,Survey,10/09/21,2021,9,10,AFG,36.080784,1,33.339249,South Asia,Low income,Afghanistan
AFG,SURVEY,16148509,39.959827,Survey,11/09/21,2021,9,11,AFG,36.080784,1,33.339249,South Asia,Low income,Afghanistan
AFG,SURVEY,16628372,41.147255,Survey,12/09/21,2021,9,12,AFG,36.080784,1,33.339249,South Asia,Low income,Afghanistan
AFG,SURVEY,16115260,39.877552,Survey,13/09/21,2021,9,13,AFG,36.080784,1,33.339249,South Asia,Low income,Afghanistan
AFG,SURVEY,16320846,40.386269,Survey,14/09/21,2021,9,14,AFG,36.080784,1,33.339249,South Asia,Low income,Afghanistan
AFG,SURVEY,16525188,40.891926,Survey,15/09/21,2021,9,15,AFG,36.080784,2,38.47963,South Asia,Low income,Afghanistan
AFG,SURVEY,16944255,41.928917,Survey,16/09/21,2021,9,16,AFG,36.080784,2,38.47963,South Asia,Low income,Afghanistan
AFG,SURVEY,16843062,41.678513,Survey,17/09/21,2021,9,17,AFG,36.080784,2,38.47963,South Asia,Low income,Afghanistan
AFG,SURVEY,17235576,42.649796,Survey,18/09/21,2021,9,18,AFG,36.080784,2,38.47963,South Asia,Low income,Afghanistan
AFG,SURVEY,17075668,42.254101,Survey,19/09/21,2021,9,19,AFG,36.080784,2,38.47963,South Asia,Low income,Afghanistan
AFG,SURVEY,15004966,37.130104,Survey,20/09/21,2021,9,20,AFG,36.080784,2,38.47963,South Asia,Low income,Afghanistan
AFG,SURVEY,15152078,37.494137,Survey,21/09/21,2021,9,21,AFG,36.080784,2,38.47963,South Asia,Low income,Afghanistan
AFG,SURVEY,15220702,37.663948,Survey,22/09/21,2021,9,22,AFG,36.080784,2,38.47963,South Asia,Low income,Afghanistan
AFG,SURVEY,14493683,35.864929,Survey,23/09/21,2021,9,23,AFG,36.080784,2,38.47963,South Asia,Low income,Afghanistan
AFG,SURVEY,14177615,35.082809,Survey,24/09/21,2021,9,24,AFG,36.080784,2,38.47963,South Asia,Low income,Afghanistan
AFG,SURVEY,14290385,35.361858,Survey,25/09/21,2021,9,25,AFG,36.080784,2,38.47963,South Asia,Low income,Afghanistan
AFG,SURVEY,14090069,34.866177,Survey,26/09/21,2021,9,26,AFG,36.080784,2,38.47963,South Asia,Low income,Afghanistan
AFG,SURVEY,14976447,37.059532,Survey,27/09/21,2021,9,27,AFG,36.080784,2,38.47963,South Asia,Low income,Afghanistan
AFG,SURVEY,15274171,37.796265,Survey,28/09/21,2021,9,28,AFG,36.080784,2,38.47963,South Asia,Low income,Afghanistan
AFG,SURVEY,15746373,38.964741,Survey,29/09/21,2021,9,29,AFG,36.080784,2,38.47963,South Asia,Low income,Afghanistan
AFG,SURVEY,15755087,38.986294,Survey,30/09/21,2021,9,30,AFG,36.080784,2,38.47963,South Asia,Low income,Afghanistan
AFG,SURVEY,16098951,39.837193,Survey,01/10/21,2021,10,1,AFG,44.311108,1,41.672474,South Asia,Low income,Afghanistan
AFG,SURVEY,15832212,39.177143,Survey,02/10/21,2021,10,2,AFG,44.311108,1,41.672474,South Asia,Low income,Afghanistan
AFG,SURVEY,16083859,39.799847,Survey,03/10/21,2021,10,3,AFG,44.311108,1,41.672474,South Asia,Low income,Afghanistan
AFG,SURVEY,16631058,41.153904,Survey,04/10/21,2021,10,4,AFG,44.311108,1,41.672474,South Asia,Low income,Afghanistan
AFG,SURVEY,16797538,41.565861,Survey,05/10/21,2021,10,5,AFG,44.311108,1,41.672474,South Asia,Low income,Afghanistan
AFG,SURVEY,16746869,41.440479,Survey,06/10/21,2021,10,6,AFG,44.311108,1,41.672474,South Asia,Low income,Afghanistan
AFG,SURVEY,16866338,41.736111,Survey,07/10/21,2021,10,7,AFG,44.311108,1,41.672474,South Asia,Low income,Afghanistan
AFG,SURVEY,16991152,42.044964,Survey,08/10/21,2021,10,8,AFG,44.311108,1,41.672474,South Asia,Low income,Afghanistan
AFG,SURVEY,17209757,42.585907,Survey,09/10/21,2021,10,9,AFG,44.311108,1,41.672474,South Asia,Low income,Afghanistan
AFG,SURVEY,17112095,42.344242,Survey,10/10/21,2021,10,10,AFG,44.311108,1,41.672474,South Asia,Low income,Afghanistan
AFG,SURVEY,17368193,42.977962,Survey,11/10/21,2021,10,11,AFG,44.311108,1,41.672474,South Asia,Low income,Afghanistan
AFG,SURVEY,17303067,42.816807,Survey,12/10/21,2021,10,12,AFG,44.311108,1,41.672474,South Asia,Low income,Afghanistan
AFG,SURVEY,17451851,43.184975,Survey,13/10/21,2021,10,13,AFG,44.311108,1,41.672474,South Asia,Low income,Afghanistan
AFG,SURVEY,17275757,42.749226,Survey,14/10/21,2021,10,14,AFG,44.311108,1,41.672474,South Asia,Low income,Afghanistan
AFG,SURVEY,17518404,43.349663,Survey,15/10/21,2021,10,15,AFG,44.311108,2,46.484104,South Asia,Low income,Afghanistan
AFG,SURVEY,17804696,44.058098,Survey,16/10/21,2021,10,16,AFG,44.311108,2,46.484104,South Asia,Low income,Afghanistan
AFG,SURVEY,17936113,44.383289,Survey,17/10/21,2021,10,17,AFG,44.311108,2,46.484104,South Asia,Low income,Afghanistan
AFG,SURVEY,18147264,44.905788,Survey,18/10/21,2021,10,18,AFG,44.311108,2,46.484104,South Asia,Low income,Afghanistan
AFG,SURVEY,18107895,44.808369,Survey,19/10/21,2021,10,19,AFG,44.311108,2,46.484104,South Asia,Low income,Afghanistan
AFG,SURVEY,18110974,44.815987,Survey,20/10/21,2021,10,20,AFG,44.311108,2,46.484104,South Asia,Low income,Afghanistan
AFG,SURVEY,18371932,45.461735,Survey,21/10/21,2021,10,21,AFG,44.311108,2,46.484104,South Asia,Low income,Afghanistan
AFG,SURVEY,19041866,47.119503,Survey,22/10/21,2021,10,22,AFG,44.311108,2,46.484104,South Asia,Low income,Afghanistan
AFG,SURVEY,19270284,47.684727,Survey,23/10/21,2021,10,23,AFG,44.311108,2,46.484104,South Asia,Low income,Afghanistan
AFG,SURVEY,19319493,47.806496,Survey,24/10/21,2021,10,24,AFG,44.311108,2,46.484104,South Asia,Low income,Afghanistan
AFG,SURVEY,19253091,47.642181,Survey,25/10/21,2021,10,25,AFG,44.311108,2,46.484104,South Asia,Low income,Afghanistan
AFG,SURVEY,19363542,47.915493,Survey,26/10/21,2021,10,26,AFG,44.311108,2,46.484104,South Asia,Low income,Afghanistan
AFG,SURVEY,19377119,47.949089,Survey,27/10/21,2021,10,27,AFG,44.311108,2,46.484104,South Asia,Low income,Afghanistan
AFG,SURVEY,19467780,48.173435,Survey,28/10/21,2021,10,28,AFG,44.311108,2,46.484104,South Asia,Low income,Afghanistan
AFG,SURVEY,19360024,47.906788,Survey,29/10/21,2021,10,29,AFG,44.311108,2,46.484104,South Asia,Low income,Afghanistan
AFG,SURVEY,19371578,47.935379,Survey,30/10/21,2021,10,30,AFG,44.311108,2,46.484104,South Asia,Low income,Afghanistan
AFG,SURVEY,19524484,48.313747,Survey,31/10/21,2021,10,31,AFG,44.311108,2,46.484104,South Asia,Low income,Afghanistan
AFG,SURVEY,19726357,48.813286,Survey,01/11/21,2021,11,1,AFG,53.18948,1,51.199284,South Asia,Low income,Afghanistan
AFG,SURVEY,19721637,48.801605,Survey,02/11/21,2021,11,2,AFG,53.18948,1,51.199284,South Asia,Low income,Afghanistan
AFG,SURVEY,19937784,49.336468,Survey,03/11/21,2021,11,3,AFG,53.18948,1,51.199284,South Asia,Low income,Afghanistan
AFG,SURVEY,20166668,49.902847,Survey,04/11/21,2021,11,4,AFG,53.18948,1,51.199284,South Asia,Low income,Afghanistan
AFG,SURVEY,20110112,49.762897,Survey,05/11/21,2021,11,5,AFG,53.18948,1,51.199284,South Asia,Low income,Afghanistan
AFG,SURVEY,20293716,50.217228,Survey,06/11/21,2021,11,6,AFG,53.18948,1,51.199284,South Asia,Low income,Afghanistan
AFG,SURVEY,20596793,50.967197,Survey,07/11/21,2021,11,7,AFG,53.18948,1,51.199284,South Asia,Low income,Afghanistan
AFG,SURVEY,20486017,50.693085,Survey,08/11/21,2021,11,8,AFG,53.18948,1,51.199284,South Asia,Low income,Afghanistan
AFG,SURVEY,21217928,52.504211,Survey,09/11/21,2021,11,9,AFG,53.18948,1,51.199284,South Asia,Low income,Afghanistan
AFG,SURVEY,21092118,52.19289,Survey,10/11/21,2021,11,10,AFG,53.18948,1,51.199284,South Asia,Low income,Afghanistan
AFG,SURVEY,21262285,52.613976,Survey,11/11/21,2021,11,11,AFG,53.18948,1,51.199284,South Asia,Low income,Afghanistan
AFG,SURVEY,21666979,53.615398,Survey,12/11/21,2021,11,12,AFG,53.18948,1,51.199284,South Asia,Low income,Afghanistan
AFG,SURVEY,21648280,53.569126,Survey,13/11/21,2021,11,13,AFG,53.18948,1,51.199284,South Asia,Low income,Afghanistan
AFG,SURVEY,21741489,53.799774,Survey,14/11/21,2021,11,14,AFG,53.18948,1,51.199284,South Asia,Low income,Afghanistan
AFG,SURVEY,21714785,53.733696,Survey,15/11/21,2021,11,15,AFG,53.18948,2,54.930901,South Asia,Low income,Afghanistan
AFG,SURVEY,21684994,53.659977,Survey,16/11/21,2021,11,16,AFG,53.18948,2,54.930901,South Asia,Low income,Afghanistan
AFG,SURVEY,21991141,54.417545,Survey,17/11/21,2021,11,17,AFG,53.18948,2,54.930901,South Asia,Low income,Afghanistan
AFG,SURVEY,21963989,54.350357,Survey,18/11/21,2021,11,18,AFG,53.18948,2,54.930901,South Asia,Low income,Afghanistan
AFG,SURVEY,21699074,53.69482,Survey,19/11/21,2021,11,19,AFG,53.18948,2,54.930901,South Asia,Low income,Afghanistan
AFG,SURVEY,21970493,54.366451,Survey,20/11/21,2021,11,20,AFG,53.18948,2,54.930901,South Asia,Low income,Afghanistan
AFG,SURVEY,22580677,55.876362,Survey,21/11/21,2021,11,21,AFG,53.18948,2,54.930901,South Asia,Low income,Afghanistan
AFG,SURVEY,22445622,55.542164,Survey,22/11/21,2021,11,22,AFG,53.18948,2,54.930901,South Asia,Low income,Afghanistan
AFG,SURVEY,22434518,55.514687,Survey,23/11/21,2021,11,23,AFG,53.18948,2,54.930901,South Asia,Low income,Afghanistan
AFG,SURVEY,22108510,54.707973,Survey,24/11/21,2021,11,24,AFG,53.18948,2,54.930901,South Asia,Low income,Afghanistan
AFG,SURVEY,22176519,54.876266,Survey,25/11/21,2021,11,25,AFG,53.18948,2,54.930901,South Asia,Low income,Afghanistan
AFG,SURVEY,22295588,55.170906,Survey,26/11/21,2021,11,26,AFG,53.18948,2,54.930901,South Asia,Low income,Afghanistan
AFG,SURVEY,22448375,55.548977,Survey,27/11/21,2021,11,27,AFG,53.18948,2,54.930901,South Asia,Low income,Afghanistan
AFG,SURVEY,22374679,55.366619,Survey,28/11/21,2021,11,28,AFG,53.18948,2,54.930901,South Asia,Low income,Afghanistan
AFG,SURVEY,22629151,55.996311,Survey,29/11/21,2021,11,29,AFG,53.18948,2,54.930901,South Asia,Low income,Afghanistan
AFG,SURVEY,22659463,56.071323,Survey,30/11/21,2021,11,30,AFG,53.18948,2,54.930901,South Asia,Low income,Afghanistan
AFG,SURVEY,22691505,56.150608,Survey,01/12/21,2021,12,1,AFG,56.26371,1,54.943344,South Asia,Low income,Afghanistan
AFG,SURVEY,22363582,55.339157,Survey,02/12/21,2021,12,2,AFG,56.26371,1,54.943344,South Asia,Low income,Afghanistan
AFG,SURVEY,22415461,55.467533,Survey,03/12/21,2021,12,3,AFG,56.26371,1,54.943344,South Asia,Low income,Afghanistan
AFG,SURVEY,22444371,55.53907,Survey,04/12/21,2021,12,4,AFG,56.26371,1,54.943344,South Asia,Low income,Afghanistan
AFG,SURVEY,22090887,54.664368,Survey,05/12/21,2021,12,5,AFG,56.26371,1,54.943344,South Asia,Low income,Afghanistan
AFG,SURVEY,21919451,54.240143,Survey,06/12/21,2021,12,6,AFG,56.26371,1,54.943344,South Asia,Low income,Afghanistan
AFG,SURVEY,21964686,54.352081,Survey,07/12/21,2021,12,7,AFG,56.26371,1,54.943344,South Asia,Low income,Afghanistan
AFG,SURVEY,21667257,53.616089,Survey,08/12/21,2021,12,8,AFG,56.26371,1,54.943344,South Asia,Low income,Afghanistan
AFG,SURVEY,21826280,54.009594,Survey,09/12/21,2021,12,9,AFG,56.26371,1,54.943344,South Asia,Low income,Afghanistan
AFG,SURVEY,22011609,54.468189,Survey,10/12/21,2021,12,10,AFG,56.26371,1,54.943344,South Asia,Low income,Afghanistan
AFG,SURVEY,22548435,55.796581,Survey,11/12/21,2021,12,11,AFG,56.26371,1,54.943344,South Asia,Low income,Afghanistan
AFG,SURVEY,22585623,55.888599,Survey,12/12/21,2021,12,12,AFG,56.26371,1,54.943344,South Asia,Low income,Afghanistan
AFG,SURVEY,22144658,54.797424,Survey,13/12/21,2021,12,13,AFG,56.26371,1,54.943344,South Asia,Low income,Afghanistan
AFG,SURVEY,22176964,54.877365,Survey,14/12/21,2021,12,14,AFG,56.26371,1,54.943344,South Asia,Low income,Afghanistan
AFG,SURVEY,22352252,55.311119,Survey,15/12/21,2021,12,15,AFG,56.26371,2,57.35107,South Asia,Low income,Afghanistan
AFG,SURVEY,22790488,56.395542,Survey,16/12/21,2021,12,16,AFG,56.26371,2,57.35107,South Asia,Low income,Afghanistan
AFG,SURVEY,22827743,56.487732,Survey,17/12/21,2021,12,17,AFG,56.26371,2,57.35107,South Asia,Low income,Afghanistan
AFG,SURVEY,23054807,57.049606,Survey,18/12/21,2021,12,18,AFG,56.26371,2,57.35107,South Asia,Low income,Afghanistan
AFG,SURVEY,23422383,57.959183,Survey,19/12/21,2021,12,19,AFG,56.26371,2,57.35107,South Asia,Low income,Afghanistan
AFG,SURVEY,23306303,57.67194,Survey,20/12/21,2021,12,20,AFG,56.26371,2,57.35107,South Asia,Low income,Afghanistan
AFG,SURVEY,22906910,56.683636,Survey,21/12/21,2021,12,21,AFG,56.26371,2,57.35107,South Asia,Low income,Afghanistan
AFG,SURVEY,23035188,57.00106,Survey,22/12/21,2021,12,22,AFG,56.26371,2,57.35107,South Asia,Low income,Afghanistan
AFG,SURVEY,23084385,57.122795,Survey,23/12/21,2021,12,23,AFG,56.26371,2,57.35107,South Asia,Low income,Afghanistan
AFG,SURVEY,23074210,57.097618,Survey,24/12/21,2021,12,24,AFG,56.26371,2,57.35107,South Asia,Low income,Afghanistan
AFG,SURVEY,23150750,57.287018,Survey,25/12/21,2021,12,25,AFG,56.26371,2,57.35107,South Asia,Low income,Afghanistan
AFG,SURVEY,23122281,57.216572,Survey,26/12/21,2021,12,26,AFG,56.26371,2,57.35107,South Asia,Low income,Afghanistan
AFG,SURVEY,23278113,57.602184,Survey,27/12/21,2021,12,27,AFG,56.26371,2,57.35107,South Asia,Low income,Afghanistan
AFG,SURVEY,23477194,58.09481,Survey,28/12/21,2021,12,28,AFG,56.26371,2,57.35107,South Asia,Low income,Afghanistan
AFG,SURVEY,23729742,58.719753,Survey,29/12/21,2021,12,29,AFG,56.26371,2,57.35107,South Asia,Low income,Afghanistan
AFG,SURVEY,23706511,58.662266,Survey,30/12/21,2021,12,30,AFG,56.26371,2,57.35107,South Asia,Low income,Afghanistan
AFG,SURVEY,23683506,58.605339,Survey,31/12/21,2021,12,31,AFG,56.26371,2,57.35107,South Asia,Low income,Afghanistan
AFG,SURVEY,24115762,59.674961,Survey,01/01/22,2022,1,1,AFG,61.276402,1,61.184235,South Asia,Low income,Afghanistan
AFG,SURVEY,23913035,59.173309,Survey,02/01/22,2022,1,2,AFG,61.276402,1,61.184235,South Asia,Low income,Afghanistan
AFG,SURVEY,24104221,59.646404,Survey,03/01/22,2022,1,3,AFG,61.276402,1,61.184235,South Asia,Low income,Afghanistan
AFG,SURVEY,24692921,61.103146,Survey,04/01/22,2022,1,4,AFG,61.276402,1,61.184235,South Asia,Low income,Afghanistan
AFG,SURVEY,24768271,61.289608,Survey,05/01/22,2022,1,5,AFG,61.276402,1,61.184235,South Asia,Low income,Afghanistan
AFG,SURVEY,24757756,61.263592,Survey,06/01/22,2022,1,6,AFG,61.276402,1,61.184235,South Asia,Low income,Afghanistan
AFG,SURVEY,24757760,61.263603,Survey,07/01/22,2022,1,7,AFG,61.276402,1,61.184235,South Asia,Low income,Afghanistan
AFG,SURVEY,25060285,62.012207,Survey,08/01/22,2022,1,8,AFG,61.276402,1,61.184235,South Asia,Low income,Afghanistan
AFG,SURVEY,25116023,62.150131,Survey,09/01/22,2022,1,9,AFG,61.276402,1,61.184235,South Asia,Low income,Afghanistan
AFG,SURVEY,24756327,61.260056,Survey,10/01/22,2022,1,10,AFG,61.276402,1,61.184235,South Asia,Low income,Afghanistan
AFG,SURVEY,24899581,61.614536,Survey,11/01/22,2022,1,11,AFG,61.276402,1,61.184235,South Asia,Low income,Afghanistan
AFG,SURVEY,24975715,61.802937,Survey,12/01/22,2022,1,12,AFG,61.276402,1,61.184235,South Asia,Low income,Afghanistan
AFG,SURVEY,25278352,62.551815,Survey,13/01/22,2022,1,13,AFG,61.276402,1,61.184235,South Asia,Low income,Afghanistan
AFG,SURVEY,24963608,61.77298,Survey,14/01/22,2022,1,14,AFG,61.276402,1,61.184235,South Asia,Low income,Afghanistan
AFG,SURVEY,24442115,60.482533,Survey,15/01/22,2022,1,15,AFG,61.276402,2,61.352303,South Asia,Low income,Afghanistan
AFG,SURVEY,24852670,61.498459,Survey,16/01/22,2022,1,16,AFG,61.276402,2,61.352303,South Asia,Low income,Afghanistan
AFG,SURVEY,24681235,61.074238,Survey,17/01/22,2022,1,17,AFG,61.276402,2,61.352303,South Asia,Low income,Afghanistan
AFG,SURVEY,24045799,59.501839,Survey,18/01/22,2022,1,18,AFG,61.276402,2,61.352303,South Asia,Low income,Afghanistan
AFG,SURVEY,24111565,59.664577,Survey,19/01/22,2022,1,19,AFG,61.276402,2,61.352303,South Asia,Low income,Afghanistan
AFG,SURVEY,24344908,60.241993,Survey,20/01/22,2022,1,20,AFG,61.276402,2,61.352303,South Asia,Low income,Afghanistan
AFG,SURVEY,24387464,60.347294,Survey,21/01/22,2022,1,21,AFG,61.276402,2,61.352303,South Asia,Low income,Afghanistan
AFG,SURVEY,24464501,60.537933,Survey,22/01/22,2022,1,22,AFG,61.276402,2,61.352303,South Asia,Low income,Afghanistan
AFG,SURVEY,24930352,61.690681,Survey,23/01/22,2022,1,23,AFG,61.276402,2,61.352303,South Asia,Low income,Afghanistan
AFG,SURVEY,25323410,62.663315,Survey,24/01/22,2022,1,24,AFG,61.276402,2,61.352303,South Asia,Low income,Afghanistan
AFG,SURVEY,25174736,62.295418,Survey,25/01/22,2022,1,25,AFG,61.276402,2,61.352303,South Asia,Low income,Afghanistan
AFG,SURVEY,24954063,61.749355,Survey,26/01/22,2022,1,26,AFG,61.276402,2,61.352303,South Asia,Low income,Afghanistan
AFG,SURVEY,24939446,61.713188,Survey,27/01/22,2022,1,27,AFG,61.276402,2,61.352303,South Asia,Low income,Afghanistan
AFG,SURVEY,24949638,61.738407,Survey,28/01/22,2022,1,28,AFG,61.276402,2,61.352303,South Asia,Low income,Afghanistan
AFG,SURVEY,25074622,62.047684,Survey,29/01/22,2022,1,29,AFG,61.276402,2,61.352303,South Asia,Low income,Afghanistan
AFG,SURVEY,25620730,63.39904,Survey,30/01/22,2022,1,30,AFG,61.276402,2,61.352303,South Asia,Low income,Afghanistan
AFG,SURVEY,25194041,62.343185,Survey,31/01/22,2022,1,31,AFG,61.276402,2,61.352303,South Asia,Low income,Afghanistan
AFG,SURVEY,25597448,63.341427,Survey,01/02/22,2022,2,1,AFG,65.518776,1,63.561153,South Asia,Low income,Afghanistan
AFG,SURVEY,25326835,62.671787,Survey,02/02/22,2022,2,2,AFG,65.518776,1,63.561153,South Asia,Low income,Afghanistan
AFG,SURVEY,25401627,62.856865,Survey,03/02/22,2022,2,3,AFG,65.518776,1,63.561153,South Asia,Low income,Afghanistan
AFG,SURVEY,25233576,62.441017,Survey,04/02/22,2022,2,4,AFG,65.518776,1,63.561153,South Asia,Low income,Afghanistan
AFG,SURVEY,25264679,62.517982,Survey,05/02/22,2022,2,5,AFG,65.518776,1,63.561153,South Asia,Low income,Afghanistan
AFG,SURVEY,25269227,62.529236,Survey,06/02/22,2022,2,6,AFG,65.518776,1,63.561153,South Asia,Low income,Afghanistan
AFG,SURVEY,25213130,62.390423,Survey,07/02/22,2022,2,7,AFG,65.518776,1,63.561153,South Asia,Low income,Afghanistan
AFG,SURVEY,25284942,62.568123,Survey,08/02/22,2022,2,8,AFG,65.518776,1,63.561153,South Asia,Low income,Afghanistan
AFG,SURVEY,25258153,62.501842,Survey,09/02/22,2022,2,9,AFG,65.518776,1,63.561153,South Asia,Low income,Afghanistan
AFG,SURVEY,25715769,63.634216,Survey,10/02/22,2022,2,10,AFG,65.518776,1,63.561153,South Asia,Low income,Afghanistan
AFG,SURVEY,25754621,63.730354,Survey,11/02/22,2022,2,11,AFG,65.518776,1,63.561153,South Asia,Low income,Afghanistan
AFG,SURVEY,26028578,64.408264,Survey,12/02/22,2022,2,12,AFG,65.518776,1,63.561153,South Asia,Low income,Afghanistan
AFG,SURVEY,27148055,67.178436,Survey,13/02/22,2022,2,13,AFG,65.518776,1,63.561153,South Asia,Low income,Afghanistan
AFG,SURVEY,27110776,67.086189,Survey,14/02/22,2022,2,14,AFG,65.518776,1,63.561153,South Asia,Low income,Afghanistan
AFG,SURVEY,27007169,66.829811,Survey,15/02/22,2022,2,15,AFG,65.518776,2,67.476395,South Asia,Low income,Afghanistan
AFG,SURVEY,27043348,66.919342,Survey,16/02/22,2022,2,16,AFG,65.518776,2,67.476395,South Asia,Low income,Afghanistan
AFG,SURVEY,27085992,67.024849,Survey,17/02/22,2022,2,17,AFG,65.518776,2,67.476395,South Asia,Low income,Afghanistan
AFG,SURVEY,27170284,67.233444,Survey,18/02/22,2022,2,18,AFG,65.518776,2,67.476395,South Asia,Low income,Afghanistan
AFG,SURVEY,27059460,66.959206,Survey,19/02/22,2022,2,19,AFG,65.518776,2,67.476395,South Asia,Low income,Afghanistan
AFG,SURVEY,27293113,67.537384,Survey,20/02/22,2022,2,20,AFG,65.518776,2,67.476395,South Asia,Low income,Afghanistan
AFG,SURVEY,27467899,67.969902,Survey,21/02/22,2022,2,21,AFG,65.518776,2,67.476395,South Asia,Low income,Afghanistan
AFG,SURVEY,27384685,67.763977,Survey,22/02/22,2022,2,22,AFG,65.518776,2,67.476395,South Asia,Low income,Afghanistan
AFG,SURVEY,27025689,66.875641,Survey,23/02/22,2022,2,23,AFG,65.518776,2,67.476395,South Asia,Low income,Afghanistan
AFG,SURVEY,27101942,67.064323,Survey,24/02/22,2022,2,24,AFG,65.518776,2,67.476395,South Asia,Low income,Afghanistan
AFG,SURVEY,27281698,67.50914,Survey,25/02/22,2022,2,25,AFG,65.518776,2,67.476395,South Asia,Low income,Afghanistan
AFG,SURVEY,27556912,68.190163,Survey,26/02/22,2022,2,26,AFG,65.518776,2,67.476395,South Asia,Low income,Afghanistan
AFG,SURVEY,27761640,68.69677,Survey,27/02/22,2022,2,27,AFG,65.518776,2,67.476395,South Asia,Low income,Afghanistan
AFG,SURVEY,27518677,68.095551,Survey,28/02/22,2022,2,28,AFG,65.518776,2,67.476395,South Asia,Low income,Afghanistan
AFG,SURVEY,26582345,65.77858,Survey,01/03/22,2022,3,1,AFG,67.854797,1,69.220612,South Asia,Low income,Afghanistan
AFG,SURVEY,26668263,65.99118,Survey,02/03/22,2022,3,2,AFG,67.854797,1,69.220612,South Asia,Low income,Afghanistan
AFG,SURVEY,26837359,66.409615,Survey,03/03/22,2022,3,3,AFG,67.854797,1,69.220612,South Asia,Low income,Afghanistan
AFG,SURVEY,27952101,69.168068,Survey,04/03/22,2022,3,4,AFG,67.854797,1,69.220612,South Asia,Low income,Afghanistan
AFG,SURVEY,28146044,69.64798,Survey,05/03/22,2022,3,5,AFG,67.854797,1,69.220612,South Asia,Low income,Afghanistan
AFG,SURVEY,27939647,69.137245,Survey,06/03/22,2022,3,6,AFG,67.854797,1,69.220612,South Asia,Low income,Afghanistan
AFG,SURVEY,28125678,69.597588,Survey,07/03/22,2022,3,7,AFG,67.854797,1,69.220612,South Asia,Low income,Afghanistan
AFG,SURVEY,28231776,69.860123,Survey,08/03/22,2022,3,8,AFG,67.854797,1,69.220612,South Asia,Low income,Afghanistan
AFG,SURVEY,28363773,70.18676,Survey,09/03/22,2022,3,9,AFG,67.854797,1,69.220612,South Asia,Low income,Afghanistan
AFG,SURVEY,28414262,70.311699,Survey,10/03/22,2022,3,10,AFG,67.854797,1,69.220612,South Asia,Low income,Afghanistan
AFG,SURVEY,28744691,71.129349,Survey,11/03/22,2022,3,11,AFG,67.854797,1,69.220612,South Asia,Low income,Afghanistan
AFG,SURVEY,28822728,71.322456,Survey,12/03/22,2022,3,12,AFG,67.854797,1,69.220612,South Asia,Low income,Afghanistan
AFG,SURVEY,28418680,70.322617,Survey,13/03/22,2022,3,13,AFG,67.854797,1,69.220612,South Asia,Low income,Afghanistan
AFG,SURVEY,28379362,70.225334,Survey,14/03/22,2022,3,14,AFG,67.854797,1,69.220612,South Asia,Low income,Afghanistan
AFG,SURVEY,28050426,69.411377,Survey,15/03/22,2022,3,15,AFG,67.854797,2,66.730003,South Asia,Low income,Afghanistan
AFG,SURVEY,28054213,69.420746,Survey,16/03/22,2022,3,16,AFG,67.854797,2,66.730003,South Asia,Low income,Afghanistan
AFG,SURVEY,28039054,69.38324,Survey,17/03/22,2022,3,17,AFG,67.854797,2,66.730003,South Asia,Low income,Afghanistan
AFG,SURVEY,27840882,68.892853,Survey,18/03/22,2022,3,18,AFG,67.854797,2,66.730003,South Asia,Low income,Afghanistan
AFG,SURVEY,27718287,68.589493,Survey,19/03/22,2022,3,19,AFG,67.854797,2,66.730003,South Asia,Low income,Afghanistan
AFG,SURVEY,27356043,67.693108,Survey,20/03/22,2022,3,20,AFG,67.854797,2,66.730003,South Asia,Low income,Afghanistan
AFG,SURVEY,27316198,67.594513,Survey,21/03/22,2022,3,21,AFG,67.854797,2,66.730003,South Asia,Low income,Afghanistan
AFG,SURVEY,26975563,66.751602,Survey,22/03/22,2022,3,22,AFG,67.854797,2,66.730003,South Asia,Low income,Afghanistan
AFG,SURVEY,26979338,66.760933,Survey,23/03/22,2022,3,23,AFG,67.854797,2,66.730003,South Asia,Low income,Afghanistan
AFG,SURVEY,26804161,66.327461,Survey,24/03/22,2022,3,24,AFG,67.854797,2,66.730003,South Asia,Low income,Afghanistan
AFG,SURVEY,26815744,66.356125,Survey,25/03/22,2022,3,25,AFG,67.854797,2,66.730003,South Asia,Low income,Afghanistan
AFG,SURVEY,26704375,66.080544,Survey,26/03/22,2022,3,26,AFG,67.854797,2,66.730003,South Asia,Low income,Afghanistan
AFG,SURVEY,26360513,65.229645,Survey,27/03/22,2022,3,27,AFG,67.854797,2,66.730003,South Asia,Low income,Afghanistan
AFG,SURVEY,25983533,64.296799,Survey,28/03/22,2022,3,28,AFG,67.854797,2,66.730003,South Asia,Low income,Afghanistan
AFG,SURVEY,25710814,63.621948,Survey,29/03/22,2022,3,29,AFG,67.854797,2,66.730003,South Asia,Low income,Afghanistan
AFG,SURVEY,25774889,63.78051,Survey,30/03/22,2022,3,30,AFG,67.854797,2,66.730003,South Asia,Low income,Afghanistan
AFG,SURVEY,25952174,64.219208,Survey,31/03/22,2022,3,31,AFG,67.854797,2,66.730003,South Asia,Low income,Afghanistan
AFG,SURVEY,26202052,64.837524,Survey,01/04/22,2022,4,1,AFG,62.559078,1,63.197514,South Asia,Low income,Afghanistan
AFG,SURVEY,26137274,64.677238,Survey,02/04/22,2022,4,2,AFG,62.559078,1,63.197514,South Asia,Low income,Afghanistan
AFG,SURVEY,26157577,64.727478,Survey,03/04/22,2022,4,3,AFG,62.559078,1,63.197514,South Asia,Low income,Afghanistan
AFG,SURVEY,25944124,64.19928,Survey,04/04/22,2022,4,4,AFG,62.559078,1,63.197514,South Asia,Low income,Afghanistan
AFG,SURVEY,25988901,64.310089,Survey,05/04/22,2022,4,5,AFG,62.559078,1,63.197514,South Asia,Low income,Afghanistan
AFG,SURVEY,25686440,63.561642,Survey,06/04/22,2022,4,6,AFG,62.559078,1,63.197514,South Asia,Low income,Afghanistan
AFG,SURVEY,25593065,63.330578,Survey,07/04/22,2022,4,7,AFG,62.559078,1,63.197514,South Asia,Low income,Afghanistan
AFG,SURVEY,25521396,63.153236,Survey,08/04/22,2022,4,8,AFG,62.559078,1,63.197514,South Asia,Low income,Afghanistan
AFG,SURVEY,25418081,62.897579,Survey,09/04/22,2022,4,9,AFG,62.559078,1,63.197514,South Asia,Low income,Afghanistan
AFG,SURVEY,24864539,61.527832,Survey,10/04/22,2022,4,10,AFG,62.559078,1,63.197514,South Asia,Low income,Afghanistan
AFG,SURVEY,25020156,61.912907,Survey,11/04/22,2022,4,11,AFG,62.559078,1,63.197514,South Asia,Low income,Afghanistan
AFG,SURVEY,25125991,62.174797,Survey,12/04/22,2022,4,12,AFG,62.559078,1,63.197514,South Asia,Low income,Afghanistan
AFG,SURVEY,24924212,61.675488,Survey,13/04/22,2022,4,13,AFG,62.559078,1,63.197514,South Asia,Low income,Afghanistan
AFG,SURVEY,24966262,61.779541,Survey,14/04/22,2022,4,14,AFG,62.559078,1,63.197514,South Asia,Low income,Afghanistan
AFG,SURVEY,24973754,61.798084,Survey,15/04/22,2022,4,15,AFG,62.559078,2,62.00045,South Asia,Low income,Afghanistan
AFG,SURVEY,24954512,61.750465,Survey,16/04/22,2022,4,16,AFG,62.559078,2,62.00045,South Asia,Low income,Afghanistan
AFG,SURVEY,25151187,62.237144,Survey,17/04/22,2022,4,17,AFG,62.559078,2,62.00045,South Asia,Low income,Afghanistan
AFG,SURVEY,24968748,61.785698,Survey,18/04/22,2022,4,18,AFG,62.559078,2,62.00045,South Asia,Low income,Afghanistan
AFG,SURVEY,25129444,62.183338,Survey,19/04/22,2022,4,19,AFG,62.559078,2,62.00045,South Asia,Low income,Afghanistan
AFG,SURVEY,24955843,61.753761,Survey,20/04/22,2022,4,20,AFG,62.559078,2,62.00045,South Asia,Low income,Afghanistan
AFG,SURVEY,25329300,62.677891,Survey,21/04/22,2022,4,21,AFG,62.559078,2,62.00045,South Asia,Low income,Afghanistan
AFG,SURVEY,25219766,62.406845,Survey,22/04/22,2022,4,22,AFG,62.559078,2,62.00045,South Asia,Low income,Afghanistan
AFG,SURVEY,25234554,62.443436,Survey,23/04/22,2022,4,23,AFG,62.559078,2,62.00045,South Asia,Low income,Afghanistan
AFG,SURVEY,25102821,62.117462,Survey,24/04/22,2022,4,24,AFG,62.559078,2,62.00045,South Asia,Low income,Afghanistan
AFG,SURVEY,24961530,61.767834,Survey,25/04/22,2022,4,25,AFG,62.559078,2,62.00045,South Asia,Low income,Afghanistan
AFG,SURVEY,25014391,61.898636,Survey,26/04/22,2022,4,26,AFG,62.559078,2,62.00045,South Asia,Low income,Afghanistan
AFG,SURVEY,24958761,61.760979,Survey,27/04/22,2022,4,27,AFG,62.559078,2,62.00045,South Asia,Low income,Afghanistan
AFG,SURVEY,24993477,61.846889,Survey,28/04/22,2022,4,28,AFG,62.559078,2,62.00045,South Asia,Low income,Afghanistan
AFG,SURVEY,25124173,62.170296,Survey,29/04/22,2022,4,29,AFG,62.559078,2,62.00045,South Asia,Low income,Afghanistan
AFG,SURVEY,24816282,61.408413,Survey,30/04/22,2022,4,30,AFG,62.559078,2,62.00045,South Asia,Low income,Afghanistan
AFG,SURVEY,24283068,60.088966,Survey,01/05/22,2022,5,1,AFG,58.687096,1,59.605255,South Asia,Low income,Afghanistan
AFG,SURVEY,24133835,59.719688,Survey,02/05/22,2022,5,2,AFG,58.687096,1,59.605255,South Asia,Low income,Afghanistan
AFG,SURVEY,23945685,59.254105,Survey,03/05/22,2022,5,3,AFG,58.687096,1,59.605255,South Asia,Low income,Afghanistan
AFG,SURVEY,23903483,59.149677,Survey,04/05/22,2022,5,4,AFG,58.687096,1,59.605255,South Asia,Low income,Afghanistan
AFG,SURVEY,23906673,59.15757,Survey,05/05/22,2022,5,5,AFG,58.687096,1,59.605255,South Asia,Low income,Afghanistan
AFG,SURVEY,23949473,59.263481,Survey,06/05/22,2022,5,6,AFG,58.687096,1,59.605255,South Asia,Low income,Afghanistan
AFG,SURVEY,24052284,59.517883,Survey,07/05/22,2022,5,7,AFG,58.687096,1,59.605255,South Asia,Low income,Afghanistan
AFG,SURVEY,24144820,59.746868,Survey,08/05/22,2022,5,8,AFG,58.687096,1,59.605255,South Asia,Low income,Afghanistan
AFG,SURVEY,24266712,60.048492,Survey,09/05/22,2022,5,9,AFG,58.687096,1,59.605255,South Asia,Low income,Afghanistan
AFG,SURVEY,24403679,60.387421,Survey,10/05/22,2022,5,10,AFG,58.687096,1,59.605255,South Asia,Low income,Afghanistan
AFG,SURVEY,24000693,59.390224,Survey,11/05/22,2022,5,11,AFG,58.687096,1,59.605255,South Asia,Low income,Afghanistan
AFG,SURVEY,23971589,59.318203,Survey,12/05/22,2022,5,12,AFG,58.687096,1,59.605255,South Asia,Low income,Afghanistan
AFG,SURVEY,24114022,59.670658,Survey,13/05/22,2022,5,13,AFG,58.687096,1,59.605255,South Asia,Low income,Afghanistan
AFG,SURVEY,24150255,59.760315,Survey,14/05/22,2022,5,14,AFG,58.687096,1,59.605255,South Asia,Low income,Afghanistan
AFG,SURVEY,24078006,59.581535,Survey,15/05/22,2022,5,15,AFG,58.687096,2,57.930969,South Asia,Low income,Afghanistan
AFG,SURVEY,24083317,59.594685,Survey,16/05/22,2022,5,16,AFG,58.687096,2,57.930969,South Asia,Low income,Afghanistan
AFG,SURVEY,23941273,59.243183,Survey,17/05/22,2022,5,17,AFG,58.687096,2,57.930969,South Asia,Low income,Afghanistan
AFG,SURVEY,23899274,59.139259,Survey,18/05/22,2022,5,18,AFG,58.687096,2,57.930969,South Asia,Low income,Afghanistan
AFG,SURVEY,23583605,58.358128,Survey,19/05/22,2022,5,19,AFG,58.687096,2,57.930969,South Asia,Low income,Afghanistan
AFG,SURVEY,23950253,59.265404,Survey,20/05/22,2022,5,20,AFG,58.687096,2,57.930969,South Asia,Low income,Afghanistan
AFG,SURVEY,23575934,58.339149,Survey,21/05/22,2022,5,21,AFG,58.687096,2,57.930969,South Asia,Low income,Afghanistan
AFG,SURVEY,23574848,58.33646,Survey,22/05/22,2022,5,22,AFG,58.687096,2,57.930969,South Asia,Low income,Afghanistan
AFG,SURVEY,23261252,57.560463,Survey,23/05/22,2022,5,23,AFG,58.687096,2,57.930969,South Asia,Low income,Afghanistan
AFG,SURVEY,23252064,57.537724,Survey,24/05/22,2022,5,24,AFG,58.687096,2,57.930969,South Asia,Low income,Afghanistan
AFG,SURVEY,23010434,56.939804,Survey,25/05/22,2022,5,25,AFG,58.687096,2,57.930969,South Asia,Low income,Afghanistan
AFG,SURVEY,22805577,56.432884,Survey,26/05/22,2022,5,26,AFG,58.687096,2,57.930969,South Asia,Low income,Afghanistan
AFG,SURVEY,22865981,56.582355,Survey,27/05/22,2022,5,27,AFG,58.687096,2,57.930969,South Asia,Low income,Afghanistan
AFG,SURVEY,22939176,56.763477,Survey,28/05/22,2022,5,28,AFG,58.687096,2,57.930969,South Asia,Low income,Afghanistan
AFG,SURVEY,22825659,56.482578,Survey,29/05/22,2022,5,29,AFG,58.687096,2,57.930969,South Asia,Low income,Afghanistan
AFG,SURVEY,23117668,57.205158,Survey,30/05/22,2022,5,30,AFG,58.687096,2,57.930969,South Asia,Low income,Afghanistan
AFG,SURVEY,23222360,57.464218,Survey,31/05/22,2022,5,31,AFG,58.687096,2,57.930969,South Asia,Low income,Afghanistan
AFG,SURVEY,23270097,57.582348,Survey,01/06/22,2022,6,1,AFG,57.377251,1,57.925724,South Asia,Low income,Afghanistan
AFG,SURVEY,23292303,57.637299,Survey,02/06/22,2022,6,2,AFG,57.377251,1,57.925724,South Asia,Low income,Afghanistan
AFG,SURVEY,23452841,58.03455,Survey,03/06/22,2022,6,3,AFG,57.377251,1,57.925724,South Asia,Low income,Afghanistan
AFG,SURVEY,23541498,58.253933,Survey,04/06/22,2022,6,4,AFG,57.377251,1,57.925724,South Asia,Low income,Afghanistan
AFG,SURVEY,23687300,58.614723,Survey,05/06/22,2022,6,5,AFG,57.377251,1,57.925724,South Asia,Low income,Afghanistan
AFG,SURVEY,23623600,58.4571,Survey,06/06/22,2022,6,6,AFG,57.377251,1,57.925724,South Asia,Low income,Afghanistan
AFG,SURVEY,23793057,58.876427,Survey,07/06/22,2022,6,7,AFG,57.377251,1,57.925724,South Asia,Low income,Afghanistan
AFG,SURVEY,23552626,58.281471,Survey,08/06/22,2022,6,8,AFG,57.377251,1,57.925724,South Asia,Low income,Afghanistan
AFG,SURVEY,23303452,57.664883,Survey,09/06/22,2022,6,9,AFG,57.377251,1,57.925724,South Asia,Low income,Afghanistan
AFG,SURVEY,23387344,57.872478,Survey,10/06/22,2022,6,10,AFG,57.377251,1,57.925724,South Asia,Low income,Afghanistan
AFG,SURVEY,23217691,57.452667,Survey,11/06/22,2022,6,11,AFG,57.377251,1,57.925724,South Asia,Low income,Afghanistan
AFG,SURVEY,23154768,57.296963,Survey,12/06/22,2022,6,12,AFG,57.377251,1,57.925724,South Asia,Low income,Afghanistan
AFG,SURVEY,23257802,57.551922,Survey,13/06/22,2022,6,13,AFG,57.377251,1,57.925724,South Asia,Low income,Afghanistan
AFG,SURVEY,23189691,57.383381,Survey,14/06/22,2022,6,14,AFG,57.377251,1,57.925724,South Asia,Low income,Afghanistan
AFG,SURVEY,23074504,57.098347,Survey,15/06/22,2022,6,15,AFG,57.377251,2,56.897339,South Asia,Low income,Afghanistan
AFG,SURVEY,22877050,56.609745,Survey,16/06/22,2022,6,16,AFG,57.377251,2,56.897339,South Asia,Low income,Afghanistan
AFG,SURVEY,23175693,57.34874,Survey,17/06/22,2022,6,17,AFG,57.377251,2,56.897339,South Asia,Low income,Afghanistan
AFG,SURVEY,23247915,57.527458,Survey,18/06/22,2022,6,18,AFG,57.377251,2,56.897339,South Asia,Low income,Afghanistan
AFG,SURVEY,23230543,57.48447,Survey,19/06/22,2022,6,19,AFG,57.377251,2,56.897339,South Asia,Low income,Afghanistan
AFG,SURVEY,23231738,57.487423,Survey,20/06/22,2022,6,20,AFG,57.377251,2,56.897339,South Asia,Low income,Afghanistan
AFG,SURVEY,23047583,57.031734,Survey,21/06/22,2022,6,21,AFG,57.377251,2,56.897339,South Asia,Low income,Afghanistan
AFG,SURVEY,23075516,57.100849,Survey,22/06/22,2022,6,22,AFG,57.377251,2,56.897339,South Asia,Low income,Afghanistan
AFG,SURVEY,23074706,57.098846,Survey,23/06/22,2022,6,23,AFG,57.377251,2,56.897339,South Asia,Low income,Afghanistan
AFG,SURVEY,22917602,56.710087,Survey,24/06/22,2022,6,24,AFG,57.377251,2,56.897339,South Asia,Low income,Afghanistan
AFG,SURVEY,22897236,56.659691,Survey,25/06/22,2022,6,25,AFG,57.377251,2,56.897339,South Asia,Low income,Afghanistan
AFG,SURVEY,23015196,56.951588,Survey,26/06/22,2022,6,26,AFG,57.377251,2,56.897339,South Asia,Low income,Afghanistan
AFG,SURVEY,22863742,56.576813,Survey,27/06/22,2022,6,27,AFG,57.377251,2,56.897339,South Asia,Low income,Afghanistan
AFG,SURVEY,22757754,56.314545,Survey,28/06/22,2022,6,28,AFG,57.377251,2,56.897339,South Asia,Low income,Afghanistan
AFG,SURVEY,22580328,55.8755,Survey,29/06/22,2022,6,29,AFG,57.377251,2,56.897339,South Asia,Low income,Afghanistan
AFG,SURVEY,22825255,56.481575,Survey,30/06/22,2022,6,30,AFG,57.377251,2,56.897339,South Asia,Low income,Afghanistan
AFG,SURVEY,22815493,56.457417,Survey,01/07/22,2022,7,1,AFG,55.8946,1,55.843945,South Asia,Low income,Afghanistan
AFG,SURVEY,22903026,56.674023,Survey,02/07/22,2022,7,2,AFG,55.8946,1,55.843945,South Asia,Low income,Afghanistan
AFG,SURVEY,22787456,56.388046,Survey,03/07/22,2022,7,3,AFG,55.8946,1,55.843945,South Asia,Low income,Afghanistan
AFG,SURVEY,22604838,55.936153,Survey,04/07/22,2022,7,4,AFG,55.8946,1,55.843945,South Asia,Low income,Afghanistan
AFG,SURVEY,22402440,55.43531,Survey,05/07/22,2022,7,5,AFG,55.8946,1,55.843945,South Asia,Low income,Afghanistan
AFG,SURVEY,22432619,55.509991,Survey,06/07/22,2022,7,6,AFG,55.8946,1,55.843945,South Asia,Low income,Afghanistan
AFG,SURVEY,22207330,54.952507,Survey,07/07/22,2022,7,7,AFG,55.8946,1,55.843945,South Asia,Low income,Afghanistan
AFG,SURVEY,22232132,55.013882,Survey,08/07/22,2022,7,8,AFG,55.8946,1,55.843945,South Asia,Low income,Afghanistan
AFG,SURVEY,22440208,55.52877,Survey,09/07/22,2022,7,9,AFG,55.8946,1,55.843945,South Asia,Low income,Afghanistan
AFG,SURVEY,22274504,55.118732,Survey,10/07/22,2022,7,10,AFG,55.8946,1,55.843945,South Asia,Low income,Afghanistan
AFG,SURVEY,22637169,56.016151,Survey,11/07/22,2022,7,11,AFG,55.8946,1,55.843945,South Asia,Low income,Afghanistan
AFG,SURVEY,22753940,56.305103,Survey,12/07/22,2022,7,12,AFG,55.8946,1,55.843945,South Asia,Low income,Afghanistan
AFG,SURVEY,22672672,56.104004,Survey,13/07/22,2022,7,13,AFG,55.8946,1,55.843945,South Asia,Low income,Afghanistan
AFG,SURVEY,22782229,56.375111,Survey,14/07/22,2022,7,14,AFG,55.8946,1,55.843945,South Asia,Low income,Afghanistan
AFG,SURVEY,22765658,56.334103,Survey,15/07/22,2022,7,15,AFG,55.8946,2,56.130997,South Asia,Low income,Afghanistan
AFG,SURVEY,22853203,56.550735,Survey,16/07/22,2022,7,16,AFG,55.8946,2,56.130997,South Asia,Low income,Afghanistan
AFG,SURVEY,22431875,55.508148,Survey,17/07/22,2022,7,17,AFG,55.8946,2,56.130997,South Asia,Low income,Afghanistan
AGO,SURVEY,15019326,48.250717,Survey,13/06/21,2021,6,13,AGO,47.211086,1,48.154564,Sub-Saharan Africa,Lower middle income,Angola
AGO,SURVEY,14959464,48.058407,Survey,14/06/21,2021,6,14,AGO,47.211086,1,48.154564,Sub-Saharan Africa,Lower middle income,Angola
AGO,SURVEY,15002268,48.195915,Survey,15/06/21,2021,6,15,AGO,47.211086,2,47.093151,Sub-Saharan Africa,Lower middle income,Angola
AGO,SURVEY,14894368,47.849281,Survey,16/06/21,2021,6,16,AGO,47.211086,2,47.093151,Sub-Saharan Africa,Lower middle income,Angola
AGO,SURVEY,14865503,47.75655,Survey,17/06/21,2021,6,17,AGO,47.211086,2,47.093151,Sub-Saharan Africa,Lower middle income,Angola
AGO,SURVEY,14893751,47.847298,Survey,18/06/21,2021,6,18,AGO,47.211086,2,47.093151,Sub-Saharan Africa,Lower middle income,Angola
AGO,SURVEY,14829190,47.639893,Survey,19/06/21,2021,6,19,AGO,47.211086,2,47.093151,Sub-Saharan Africa,Lower middle income,Angola
AGO,SURVEY,14761952,47.423885,Survey,20/06/21,2021,6,20,AGO,47.211086,2,47.093151,Sub-Saharan Africa,Lower middle income,Angola
AGO,SURVEY,14671996,47.134895,Survey,21/06/21,2021,6,21,AGO,47.211086,2,47.093151,Sub-Saharan Africa,Lower middle income,Angola
AGO,SURVEY,14535013,46.694824,Survey,22/06/21,2021,6,22,AGO,47.211086,2,47.093151,Sub-Saharan Africa,Lower middle income,Angola
AGO,SURVEY,14607119,46.926476,Survey,23/06/21,2021,6,23,AGO,47.211086,2,47.093151,Sub-Saharan Africa,Lower middle income,Angola
AGO,SURVEY,14587244,46.862621,Survey,24/06/21,2021,6,24,AGO,47.211086,2,47.093151,Sub-Saharan Africa,Lower middle income,Angola
AGO,SURVEY,14551753,46.748604,Survey,25/06/21,2021,6,25,AGO,47.211086,2,47.093151,Sub-Saharan Africa,Lower middle income,Angola
AGO,SURVEY,14560010,46.775131,Survey,26/06/21,2021,6,26,AGO,47.211086,2,47.093151,Sub-Saharan Africa,Lower middle income,Angola
AGO,SURVEY,14564138,46.788387,Survey,27/06/21,2021,6,27,AGO,47.211086,2,47.093151,Sub-Saharan Africa,Lower middle income,Angola
AGO,SURVEY,14417382,46.316929,Survey,28/06/21,2021,6,28,AGO,47.211086,2,47.093151,Sub-Saharan Africa,Lower middle income,Angola
AGO,SURVEY,14390138,46.229404,Survey,29/06/21,2021,6,29,AGO,47.211086,2,47.093151,Sub-Saharan Africa,Lower middle income,Angola
AGO,SURVEY,14412215,46.300327,Survey,30/06/21,2021,6,30,AGO,47.211086,2,47.093151,Sub-Saharan Africa,Lower middle income,Angola
AGO,SURVEY,14386108,46.216457,Survey,01/07/21,2021,7,1,AGO,45.839695,1,45.881248,Sub-Saharan Africa,Lower middle income,Angola
AGO,SURVEY,14288176,45.901844,Survey,02/07/21,2021,7,2,AGO,45.839695,1,45.881248,Sub-Saharan Africa,Lower middle income,Angola
AGO,SURVEY,14243687,45.758919,Survey,03/07/21,2021,7,3,AGO,45.839695,1,45.881248,Sub-Saharan Africa,Lower middle income,Angola
AGO,SURVEY,14185992,45.57357,Survey,04/07/21,2021,7,4,AGO,45.839695,1,45.881248,Sub-Saharan Africa,Lower middle income,Angola
AGO,SURVEY,14241898,45.753174,Survey,05/07/21,2021,7,5,AGO,45.839695,1,45.881248,Sub-Saharan Africa,Lower middle income,Angola
AGO,SURVEY,14305388,45.957138,Survey,06/07/21,2021,7,6,AGO,45.839695,1,45.881248,Sub-Saharan Africa,Lower middle income,Angola
AGO,SURVEY,14241991,45.753471,Survey,07/07/21,2021,7,7,AGO,45.839695,1,45.881248,Sub-Saharan Africa,Lower middle income,Angola
AGO,SURVEY,14224620,45.697666,Survey,08/07/21,2021,7,8,AGO,45.839695,1,45.881248,Sub-Saharan Africa,Lower middle income,Angola
AGO,SURVEY,14310073,45.972191,Survey,09/07/21,2021,7,9,AGO,45.839695,1,45.881248,Sub-Saharan Africa,Lower middle income,Angola
AGO,SURVEY,14311283,45.976074,Survey,10/07/21,2021,7,10,AGO,45.839695,1,45.881248,Sub-Saharan Africa,Lower middle income,Angola
AGO,SURVEY,14309870,45.971535,Survey,11/07/21,2021,7,11,AGO,45.839695,1,45.881248,Sub-Saharan Africa,Lower middle income,Angola
AGO,SURVEY,14272449,45.851318,Survey,12/07/21,2021,7,12,AGO,45.839695,1,45.881248,Sub-Saharan Africa,Lower middle income,Angola
AGO,SURVEY,14267657,45.835922,Survey,13/07/21,2021,7,13,AGO,45.839695,1,45.881248,Sub-Saharan Africa,Lower middle income,Angola
AGO,SURVEY,14355521,46.118195,Survey,14/07/21,2021,7,14,AGO,45.839695,1,45.881248,Sub-Saharan Africa,Lower middle income,Angola
AGO,SURVEY,14380576,46.198685,Survey,15/07/21,2021,7,15,AGO,45.839695,2,45.805477,Sub-Saharan Africa,Lower middle income,Angola
AGO,SURVEY,14348133,46.09446,Survey,16/07/21,2021,7,16,AGO,45.839695,2,45.805477,Sub-Saharan Africa,Lower middle income,Angola
AGO,SURVEY,14242834,45.75618,Survey,17/07/21,2021,7,17,AGO,45.839695,2,45.805477,Sub-Saharan Africa,Lower middle income,Angola
AGO,SURVEY,14112481,45.33741,Survey,18/07/21,2021,7,18,AGO,45.839695,2,45.805477,Sub-Saharan Africa,Lower middle income,Angola
AGO,SURVEY,14039535,45.103065,Survey,19/07/21,2021,7,19,AGO,45.839695,2,45.805477,Sub-Saharan Africa,Lower middle income,Angola
AGO,SURVEY,14037745,45.097317,Survey,20/07/21,2021,7,20,AGO,45.839695,2,45.805477,Sub-Saharan Africa,Lower middle income,Angola
AGO,SURVEY,14081804,45.238857,Survey,21/07/21,2021,7,21,AGO,45.839695,2,45.805477,Sub-Saharan Africa,Lower middle income,Angola
AGO,SURVEY,14110531,45.331142,Survey,22/07/21,2021,7,22,AGO,45.839695,2,45.805477,Sub-Saharan Africa,Lower middle income,Angola
AGO,SURVEY,14072721,45.209675,Survey,23/07/21,2021,7,23,AGO,45.839695,2,45.805477,Sub-Saharan Africa,Lower middle income,Angola
AGO,SURVEY,14189516,45.584888,Survey,24/07/21,2021,7,24,AGO,45.839695,2,45.805477,Sub-Saharan Africa,Lower middle income,Angola
AGO,SURVEY,14197614,45.610905,Survey,25/07/21,2021,7,25,AGO,45.839695,2,45.805477,Sub-Saharan Africa,Lower middle income,Angola
AGO,SURVEY,14250970,45.782314,Survey,26/07/21,2021,7,26,AGO,45.839695,2,45.805477,Sub-Saharan Africa,Lower middle income,Angola
AGO,SURVEY,14321324,46.008335,Survey,27/07/21,2021,7,27,AGO,45.839695,2,45.805477,Sub-Saharan Africa,Lower middle income,Angola
AGO,SURVEY,14455586,46.439659,Survey,28/07/21,2021,7,28,AGO,45.839695,2,45.805477,Sub-Saharan Africa,Lower middle income,Angola
AGO,SURVEY,14463337,46.464558,Survey,29/07/21,2021,7,29,AGO,45.839695,2,45.805477,Sub-Saharan Africa,Lower middle income,Angola
AGO,SURVEY,14584103,46.852531,Survey,30/07/21,2021,7,30,AGO,45.839695,2,45.805477,Sub-Saharan Africa,Lower middle income,Angola
AGO,SURVEY,14500249,46.583141,Survey,31/07/21,2021,7,31,AGO,45.839695,2,45.805477,Sub-Saharan Africa,Lower middle income,Angola
AGO,SURVEY,14593299,46.882072,Survey,01/08/21,2021,8,1,AGO,46.142311,1,46.594795,Sub-Saharan Africa,Lower middle income,Angola
AGO,SURVEY,14518170,46.640717,Survey,02/08/21,2021,8,2,AGO,46.142311,1,46.594795,Sub-Saharan Africa,Lower middle income,Angola
AGO,SURVEY,14442816,46.398636,Survey,03/08/21,2021,8,3,AGO,46.142311,1,46.594795,Sub-Saharan Africa,Lower middle income,Angola
AGO,SURVEY,14419618,46.324112,Survey,04/08/21,2021,8,4,AGO,46.142311,1,46.594795,Sub-Saharan Africa,Lower middle income,Angola
AGO,SURVEY,14551119,46.746567,Survey,05/08/21,2021,8,5,AGO,46.142311,1,46.594795,Sub-Saharan Africa,Lower middle income,Angola
AGO,SURVEY,14601538,46.908543,Survey,06/08/21,2021,8,6,AGO,46.142311,1,46.594795,Sub-Saharan Africa,Lower middle income,Angola
AGO,SURVEY,14492678,46.558823,Survey,07/08/21,2021,8,7,AGO,46.142311,1,46.594795,Sub-Saharan Africa,Lower middle income,Angola
AGO,SURVEY,14367393,46.156334,Survey,08/08/21,2021,8,8,AGO,46.142311,1,46.594795,Sub-Saharan Africa,Lower middle income,Angola
AGO,SURVEY,14444781,46.404949,Survey,09/08/21,2021,8,9,AGO,46.142311,1,46.594795,Sub-Saharan Africa,Lower middle income,Angola
AGO,SURVEY,14524136,46.659882,Survey,10/08/21,2021,8,10,AGO,46.142311,1,46.594795,Sub-Saharan Africa,Lower middle income,Angola
AGO,SURVEY,14557046,46.765606,Survey,11/08/21,2021,8,11,AGO,46.142311,1,46.594795,Sub-Saharan Africa,Lower middle income,Angola
AGO,SURVEY,14525542,46.664398,Survey,12/08/21,2021,8,12,AGO,46.142311,1,46.594795,Sub-Saharan Africa,Lower middle income,Angola
AGO,SURVEY,14585658,46.857529,Survey,13/08/21,2021,8,13,AGO,46.142311,1,46.594795,Sub-Saharan Africa,Lower middle income,Angola
AGO,SURVEY,14430461,46.358944,Survey,14/08/21,2021,8,14,AGO,46.142311,1,46.594795,Sub-Saharan Africa,Lower middle income,Angola
AGO,SURVEY,14345218,46.085094,Survey,15/08/21,2021,8,15,AGO,46.142311,2,45.76968,Sub-Saharan Africa,Lower middle income,Angola
AGO,SURVEY,14273752,45.855503,Survey,16/08/21,2021,8,16,AGO,46.142311,2,45.76968,Sub-Saharan Africa,Lower middle income,Angola
AGO,SURVEY,14281445,45.880219,Survey,17/08/21,2021,8,17,AGO,46.142311,2,45.76968,Sub-Saharan Africa,Lower middle income,Angola
AGO,SURVEY,14242818,45.756126,Survey,18/08/21,2021,8,18,AGO,46.142311,2,45.76968,Sub-Saharan Africa,Lower middle income,Angola
AGO,SURVEY,14192657,45.594982,Survey,19/08/21,2021,8,19,AGO,46.142311,2,45.76968,Sub-Saharan Africa,Lower middle income,Angola
AGO,SURVEY,14191085,45.589931,Survey,20/08/21,2021,8,20,AGO,46.142311,2,45.76968,Sub-Saharan Africa,Lower middle income,Angola
AGO,SURVEY,14130619,45.395679,Survey,21/08/21,2021,8,21,AGO,46.142311,2,45.76968,Sub-Saharan Africa,Lower middle income,Angola
AGO,SURVEY,14133050,45.403488,Survey,22/08/21,2021,8,22,AGO,46.142311,2,45.76968,Sub-Saharan Africa,Lower middle income,Angola
AGO,SURVEY,14150177,45.458511,Survey,23/08/21,2021,8,23,AGO,46.142311,2,45.76968,Sub-Saharan Africa,Lower middle income,Angola
AGO,SURVEY,14159176,45.487423,Survey,24/08/21,2021,8,24,AGO,46.142311,2,45.76968,Sub-Saharan Africa,Lower middle income,Angola
AGO,SURVEY,14282519,45.883671,Survey,25/08/21,2021,8,25,AGO,46.142311,2,45.76968,Sub-Saharan Africa,Lower middle income,Angola
AGO,SURVEY,14342789,46.07729,Survey,26/08/21,2021,8,26,AGO,46.142311,2,45.76968,Sub-Saharan Africa,Lower middle income,Angola
AGO,SURVEY,14367609,46.157028,Survey,27/08/21,2021,8,27,AGO,46.142311,2,45.76968,Sub-Saharan Africa,Lower middle income,Angola
AGO,SURVEY,14361658,46.137909,Survey,28/08/21,2021,8,28,AGO,46.142311,2,45.76968,Sub-Saharan Africa,Lower middle income,Angola
AGO,SURVEY,14312425,45.979744,Survey,29/08/21,2021,8,29,AGO,46.142311,2,45.76968,Sub-Saharan Africa,Lower middle income,Angola
AGO,SURVEY,14230020,45.715012,Survey,30/08/21,2021,8,30,AGO,46.142311,2,45.76968,Sub-Saharan Africa,Lower middle income,Angola
AGO,SURVEY,14202603,45.626934,Survey,31/08/21,2021,8,31,AGO,46.142311,2,45.76968,Sub-Saharan Africa,Lower middle income,Angola
AGO,SURVEY,14189168,45.583771,Survey,01/09/21,2021,9,1,AGO,45.142403,1,45.29855,Sub-Saharan Africa,Lower middle income,Angola
AGO,SURVEY,14186311,45.574593,Survey,02/09/21,2021,9,2,AGO,45.142403,1,45.29855,Sub-Saharan Africa,Lower middle income,Angola
AGO,SURVEY,14119438,45.35976,Survey,03/09/21,2021,9,3,AGO,45.142403,1,45.29855,Sub-Saharan Africa,Lower middle income,Angola
AGO,SURVEY,14104796,45.312721,Survey,04/09/21,2021,9,4,AGO,45.142403,1,45.29855,Sub-Saharan Africa,Lower middle income,Angola
AGO,SURVEY,14081041,45.236404,Survey,05/09/21,2021,9,5,AGO,45.142403,1,45.29855,Sub-Saharan Africa,Lower middle income,Angola
AGO,SURVEY,14068755,45.196934,Survey,06/09/21,2021,9,6,AGO,45.142403,1,45.29855,Sub-Saharan Africa,Lower middle income,Angola
AGO,SURVEY,14127242,45.38483,Survey,07/09/21,2021,9,7,AGO,45.142403,1,45.29855,Sub-Saharan Africa,Lower middle income,Angola
AGO,SURVEY,14111685,45.33485,Survey,08/09/21,2021,9,8,AGO,45.142403,1,45.29855,Sub-Saharan Africa,Lower middle income,Angola
AGO,SURVEY,14139461,45.424088,Survey,09/09/21,2021,9,9,AGO,45.142403,1,45.29855,Sub-Saharan Africa,Lower middle income,Angola
AGO,SURVEY,14089532,45.263683,Survey,10/09/21,2021,9,10,AGO,45.142403,1,45.29855,Sub-Saharan Africa,Lower middle income,Angola
AGO,SURVEY,14052570,45.144939,Survey,11/09/21,2021,9,11,AGO,45.142403,1,45.29855,Sub-Saharan Africa,Lower middle income,Angola
AGO,SURVEY,14077761,45.225868,Survey,12/09/21,2021,9,12,AGO,45.142403,1,45.29855,Sub-Saharan Africa,Lower middle income,Angola
AGO,SURVEY,13993124,44.953964,Survey,13/09/21,2021,9,13,AGO,45.142403,1,45.29855,Sub-Saharan Africa,Lower middle income,Angola
AGO,SURVEY,14064510,45.183296,Survey,14/09/21,2021,9,14,AGO,45.142403,1,45.29855,Sub-Saharan Africa,Lower middle income,Angola
AGO,SURVEY,14048170,45.130806,Survey,15/09/21,2021,9,15,AGO,45.142403,2,45.005775,Sub-Saharan Africa,Lower middle income,Angola
AGO,SURVEY,13959644,44.846409,Survey,16/09/21,2021,9,16,AGO,45.142403,2,45.005775,Sub-Saharan Africa,Lower middle income,Angola
AGO,SURVEY,13907322,44.678322,Survey,17/09/21,2021,9,17,AGO,45.142403,2,45.005775,Sub-Saharan Africa,Lower middle income,Angola
AGO,SURVEY,13955461,44.832973,Survey,18/09/21,2021,9,18,AGO,45.142403,2,45.005775,Sub-Saharan Africa,Lower middle income,Angola
AGO,SURVEY,13986224,44.931801,Survey,19/09/21,2021,9,19,AGO,45.142403,2,45.005775,Sub-Saharan Africa,Lower middle income,Angola
AGO,SURVEY,14055541,45.154484,Survey,20/09/21,2021,9,20,AGO,45.142403,2,45.005775,Sub-Saharan Africa,Lower middle income,Angola
AGO,SURVEY,14021830,45.046188,Survey,21/09/21,2021,9,21,AGO,45.142403,2,45.005775,Sub-Saharan Africa,Lower middle income,Angola
AGO,SURVEY,13985225,44.928589,Survey,22/09/21,2021,9,22,AGO,45.142403,2,45.005775,Sub-Saharan Africa,Lower middle income,Angola
AGO,SURVEY,13999062,44.973042,Survey,23/09/21,2021,9,23,AGO,45.142403,2,45.005775,Sub-Saharan Africa,Lower middle income,Angola
AGO,SURVEY,14027211,45.063473,Survey,24/09/21,2021,9,24,AGO,45.142403,2,45.005775,Sub-Saharan Africa,Lower middle income,Angola
AGO,SURVEY,13959630,44.846363,Survey,25/09/21,2021,9,25,AGO,45.142403,2,45.005775,Sub-Saharan Africa,Lower middle income,Angola
AGO,SURVEY,14010044,45.008324,Survey,26/09/21,2021,9,26,AGO,45.142403,2,45.005775,Sub-Saharan Africa,Lower middle income,Angola
AGO,SURVEY,13963766,44.85965,Survey,27/09/21,2021,9,27,AGO,45.142403,2,45.005775,Sub-Saharan Africa,Lower middle income,Angola
AGO,SURVEY,14031718,45.077953,Survey,28/09/21,2021,9,28,AGO,45.142403,2,45.005775,Sub-Saharan Africa,Lower middle income,Angola
AGO,SURVEY,14108874,45.325821,Survey,29/09/21,2021,9,29,AGO,45.142403,2,45.005775,Sub-Saharan Africa,Lower middle income,Angola
AGO,SURVEY,14128286,45.388184,Survey,30/09/21,2021,9,30,AGO,45.142403,2,45.005775,Sub-Saharan Africa,Lower middle income,Angola
AGO,SURVEY,14077113,45.223789,Survey,01/10/21,2021,10,1,AGO,45.433987,1,45.343544,Sub-Saharan Africa,Lower middle income,Angola
AGO,SURVEY,14043245,45.114983,Survey,02/10/21,2021,10,2,AGO,45.433987,1,45.343544,Sub-Saharan Africa,Lower middle income,Angola
AGO,SURVEY,13948745,44.811394,Survey,03/10/21,2021,10,3,AGO,45.433987,1,45.343544,Sub-Saharan Africa,Lower middle income,Angola
AGO,SURVEY,14082540,45.241222,Survey,04/10/21,2021,10,4,AGO,45.433987,1,45.343544,Sub-Saharan Africa,Lower middle income,Angola
AGO,SURVEY,14060756,45.171242,Survey,05/10/21,2021,10,5,AGO,45.433987,1,45.343544,Sub-Saharan Africa,Lower middle income,Angola
AGO,SURVEY,14077640,45.225479,Survey,06/10/21,2021,10,6,AGO,45.433987,1,45.343544,Sub-Saharan Africa,Lower middle income,Angola
AGO,SURVEY,14111124,45.33305,Survey,07/10/21,2021,10,7,AGO,45.433987,1,45.343544,Sub-Saharan Africa,Lower middle income,Angola
AGO,SURVEY,14130265,45.394543,Survey,08/10/21,2021,10,8,AGO,45.433987,1,45.343544,Sub-Saharan Africa,Lower middle income,Angola
AGO,SURVEY,14128435,45.388664,Survey,09/10/21,2021,10,9,AGO,45.433987,1,45.343544,Sub-Saharan Africa,Lower middle income,Angola
AGO,SURVEY,14136489,45.414536,Survey,10/10/21,2021,10,10,AGO,45.433987,1,45.343544,Sub-Saharan Africa,Lower middle income,Angola
AGO,SURVEY,14177828,45.54734,Survey,11/10/21,2021,10,11,AGO,45.433987,1,45.343544,Sub-Saharan Africa,Lower middle income,Angola
AGO,SURVEY,14148859,45.454277,Survey,12/10/21,2021,10,12,AGO,45.433987,1,45.343544,Sub-Saharan Africa,Lower middle income,Angola
AGO,SURVEY,14272477,45.85141,Survey,13/10/21,2021,10,13,AGO,45.433987,1,45.343544,Sub-Saharan Africa,Lower middle income,Angola
AGO,SURVEY,14205949,45.637684,Survey,14/10/21,2021,10,14,AGO,45.433987,1,45.343544,Sub-Saharan Africa,Lower middle income,Angola
AGO,SURVEY,14274748,45.858704,Survey,15/10/21,2021,10,15,AGO,45.433987,2,45.508472,Sub-Saharan Africa,Lower middle income,Angola
AGO,SURVEY,14294287,45.921474,Survey,16/10/21,2021,10,16,AGO,45.433987,2,45.508472,Sub-Saharan Africa,Lower middle income,Angola
AGO,SURVEY,14332056,46.042812,Survey,17/10/21,2021,10,17,AGO,45.433987,2,45.508472,Sub-Saharan Africa,Lower middle income,Angola
AGO,SURVEY,14405189,46.277756,Survey,18/10/21,2021,10,18,AGO,45.433987,2,45.508472,Sub-Saharan Africa,Lower middle income,Angola
AGO,SURVEY,14383194,46.207092,Survey,19/10/21,2021,10,19,AGO,45.433987,2,45.508472,Sub-Saharan Africa,Lower middle income,Angola
AGO,SURVEY,14379061,46.193817,Survey,20/10/21,2021,10,20,AGO,45.433987,2,45.508472,Sub-Saharan Africa,Lower middle income,Angola
AGO,SURVEY,14361850,46.138527,Survey,21/10/21,2021,10,21,AGO,45.433987,2,45.508472,Sub-Saharan Africa,Lower middle income,Angola
AGO,SURVEY,14260356,45.812469,Survey,22/10/21,2021,10,22,AGO,45.433987,2,45.508472,Sub-Saharan Africa,Lower middle income,Angola
AGO,SURVEY,14231306,45.719143,Survey,23/10/21,2021,10,23,AGO,45.433987,2,45.508472,Sub-Saharan Africa,Lower middle income,Angola
AGO,SURVEY,14048394,45.131527,Survey,24/10/21,2021,10,24,AGO,45.433987,2,45.508472,Sub-Saharan Africa,Lower middle income,Angola
AGO,SURVEY,13970832,44.882351,Survey,25/10/21,2021,10,25,AGO,45.433987,2,45.508472,Sub-Saharan Africa,Lower middle income,Angola
AGO,SURVEY,14006081,44.99559,Survey,26/10/21,2021,10,26,AGO,45.433987,2,45.508472,Sub-Saharan Africa,Lower middle income,Angola
AGO,SURVEY,14094310,45.279034,Survey,27/10/21,2021,10,27,AGO,45.433987,2,45.508472,Sub-Saharan Africa,Lower middle income,Angola
AGO,SURVEY,13987582,44.936161,Survey,28/10/21,2021,10,28,AGO,45.433987,2,45.508472,Sub-Saharan Africa,Lower middle income,Angola
AGO,SURVEY,13958757,44.843559,Survey,29/10/21,2021,10,29,AGO,45.433987,2,45.508472,Sub-Saharan Africa,Lower middle income,Angola
AGO,SURVEY,13922706,44.727741,Survey,30/10/21,2021,10,30,AGO,45.433987,2,45.508472,Sub-Saharan Africa,Lower middle income,Angola
AGO,SURVEY,13906677,44.676247,Survey,31/10/21,2021,10,31,AGO,45.433987,2,45.508472,Sub-Saharan Africa,Lower middle income,Angola
AGO,SURVEY,13968799,44.87582,Survey,01/11/21,2021,11,1,AGO,44.955673,1,44.868912,Sub-Saharan Africa,Lower middle income,Angola
AGO,SURVEY,14038011,45.098167,Survey,02/11/21,2021,11,2,AGO,44.955673,1,44.868912,Sub-Saharan Africa,Lower middle income,Angola
AGO,SURVEY,14078495,45.22823,Survey,03/11/21,2021,11,3,AGO,44.955673,1,44.868912,Sub-Saharan Africa,Lower middle income,Angola
AGO,SURVEY,13995499,44.961594,Survey,04/11/21,2021,11,4,AGO,44.955673,1,44.868912,Sub-Saharan Africa,Lower middle income,Angola
AGO,SURVEY,13970528,44.881374,Survey,05/11/21,2021,11,5,AGO,44.955673,1,44.868912,Sub-Saharan Africa,Lower middle income,Angola
AGO,SURVEY,14015315,45.025257,Survey,06/11/21,2021,11,6,AGO,44.955673,1,44.868912,Sub-Saharan Africa,Lower middle income,Angola
AGO,SURVEY,13966687,44.869034,Survey,07/11/21,2021,11,7,AGO,44.955673,1,44.868912,Sub-Saharan Africa,Lower middle income,Angola
AGO,SURVEY,13889916,44.622402,Survey,08/11/21,2021,11,8,AGO,44.955673,1,44.868912,Sub-Saharan Africa,Lower middle income,Angola
AGO,SURVEY,13775896,44.256104,Survey,09/11/21,2021,11,9,AGO,44.955673,1,44.868912,Sub-Saharan Africa,Lower middle income,Angola
AGO,SURVEY,13738229,44.135098,Survey,10/11/21,2021,11,10,AGO,44.955673,1,44.868912,Sub-Saharan Africa,Lower middle income,Angola
AGO,SURVEY,13749898,44.172585,Survey,11/11/21,2021,11,11,AGO,44.955673,1,44.868912,Sub-Saharan Africa,Lower middle income,Angola
AGO,SURVEY,14026523,45.061264,Survey,12/11/21,2021,11,12,AGO,44.955673,1,44.868912,Sub-Saharan Africa,Lower middle income,Angola
AGO,SURVEY,14118238,45.355904,Survey,13/11/21,2021,11,13,AGO,44.955673,1,44.868912,Sub-Saharan Africa,Lower middle income,Angola
AGO,SURVEY,14201050,45.621944,Survey,14/11/21,2021,11,14,AGO,44.955673,1,44.868912,Sub-Saharan Africa,Lower middle income,Angola
AGO,SURVEY,14190158,45.586952,Survey,15/11/21,2021,11,15,AGO,44.955673,2,45.031586,Sub-Saharan Africa,Lower middle income,Angola
AGO,SURVEY,14237257,45.738262,Survey,16/11/21,2021,11,16,AGO,44.955673,2,45.031586,Sub-Saharan Africa,Lower middle income,Angola
AGO,SURVEY,14186537,45.575321,Survey,17/11/21,2021,11,17,AGO,44.955673,2,45.031586,Sub-Saharan Africa,Lower middle income,Angola
AGO,SURVEY,14127205,45.384712,Survey,18/11/21,2021,11,18,AGO,44.955673,2,45.031586,Sub-Saharan Africa,Lower middle income,Angola
AGO,SURVEY,14140486,45.42738,Survey,19/11/21,2021,11,19,AGO,44.955673,2,45.031586,Sub-Saharan Africa,Lower middle income,Angola
AGO,SURVEY,14105863,45.316147,Survey,20/11/21,2021,11,20,AGO,44.955673,2,45.031586,Sub-Saharan Africa,Lower middle income,Angola
AGO,SURVEY,14114673,45.344452,Survey,21/11/21,2021,11,21,AGO,44.955673,2,45.031586,Sub-Saharan Africa,Lower middle income,Angola
AGO,SURVEY,14205338,45.635719,Survey,22/11/21,2021,11,22,AGO,44.955673,2,45.031586,Sub-Saharan Africa,Lower middle income,Angola
AGO,SURVEY,13983394,44.922707,Survey,23/11/21,2021,11,23,AGO,44.955673,2,45.031586,Sub-Saharan Africa,Lower middle income,Angola
AGO,SURVEY,13966703,44.869087,Survey,24/11/21,2021,11,24,AGO,44.955673,2,45.031586,Sub-Saharan Africa,Lower middle income,Angola
AGO,SURVEY,13855867,44.513016,Survey,25/11/21,2021,11,25,AGO,44.955673,2,45.031586,Sub-Saharan Africa,Lower middle income,Angola
AGO,SURVEY,13848320,44.488773,Survey,26/11/21,2021,11,26,AGO,44.955673,2,45.031586,Sub-Saharan Africa,Lower middle income,Angola
AGO,SURVEY,13836870,44.451988,Survey,27/11/21,2021,11,27,AGO,44.955673,2,45.031586,Sub-Saharan Africa,Lower middle income,Angola
AGO,SURVEY,13829258,44.427536,Survey,28/11/21,2021,11,28,AGO,44.955673,2,45.031586,Sub-Saharan Africa,Lower middle income,Angola
AGO,SURVEY,13811767,44.371342,Survey,29/11/21,2021,11,29,AGO,44.955673,2,45.031586,Sub-Saharan Africa,Lower middle income,Angola
AGO,SURVEY,13836868,44.451981,Survey,30/11/21,2021,11,30,AGO,44.955673,2,45.031586,Sub-Saharan Africa,Lower middle income,Angola
AGO,SURVEY,13857410,44.517975,Survey,01/12/21,2021,12,1,AGO,45.632187,1,45.036709,Sub-Saharan Africa,Lower middle income,Angola
AGO,SURVEY,13949841,44.814919,Survey,02/12/21,2021,12,2,AGO,45.632187,1,45.036709,Sub-Saharan Africa,Lower middle income,Angola
AGO,SURVEY,13940108,44.783649,Survey,03/12/21,2021,12,3,AGO,45.632187,1,45.036709,Sub-Saharan Africa,Lower middle income,Angola
AGO,SURVEY,13983488,44.923012,Survey,04/12/21,2021,12,4,AGO,45.632187,1,45.036709,Sub-Saharan Africa,Lower middle income,Angola
AGO,SURVEY,13985561,44.929668,Survey,05/12/21,2021,12,5,AGO,45.632187,1,45.036709,Sub-Saharan Africa,Lower middle income,Angola
AGO,SURVEY,14004378,44.99012,Survey,06/12/21,2021,12,6,AGO,45.632187,1,45.036709,Sub-Saharan Africa,Lower middle income,Angola
AGO,SURVEY,13991110,44.947495,Survey,07/12/21,2021,12,7,AGO,45.632187,1,45.036709,Sub-Saharan Africa,Lower middle income,Angola
AGO,SURVEY,14000677,44.97823,Survey,08/12/21,2021,12,8,AGO,45.632187,1,45.036709,Sub-Saharan Africa,Lower middle income,Angola
AGO,SURVEY,14115757,45.347935,Survey,09/12/21,2021,12,9,AGO,45.632187,1,45.036709,Sub-Saharan Africa,Lower middle income,Angola
AGO,SURVEY,14147000,45.448303,Survey,10/12/21,2021,12,10,AGO,45.632187,1,45.036709,Sub-Saharan Africa,Lower middle income,Angola
AGO,SURVEY,14124108,45.374763,Survey,11/12/21,2021,12,11,AGO,45.632187,1,45.036709,Sub-Saharan Africa,Lower middle income,Angola
AGO,SURVEY,14073473,45.212093,Survey,12/12/21,2021,12,12,AGO,45.632187,1,45.036709,Sub-Saharan Africa,Lower middle income,Angola
AGO,SURVEY,14000339,44.977142,Survey,13/12/21,2021,12,13,AGO,45.632187,1,45.036709,Sub-Saharan Africa,Lower middle income,Angola
AGO,SURVEY,14091065,45.268612,Survey,14/12/21,2021,12,14,AGO,45.632187,1,45.036709,Sub-Saharan Africa,Lower middle income,Angola
AGO,SURVEY,14180738,45.55669,Survey,15/12/21,2021,12,15,AGO,45.632187,2,46.122585,Sub-Saharan Africa,Lower middle income,Angola
AGO,SURVEY,14227964,45.708405,Survey,16/12/21,2021,12,16,AGO,45.632187,2,46.122585,Sub-Saharan Africa,Lower middle income,Angola
AGO,SURVEY,14240062,45.747272,Survey,17/12/21,2021,12,17,AGO,45.632187,2,46.122585,Sub-Saharan Africa,Lower middle income,Angola
AGO,SURVEY,14346573,46.089447,Survey,18/12/21,2021,12,18,AGO,45.632187,2,46.122585,Sub-Saharan Africa,Lower middle income,Angola
AGO,SURVEY,14355016,46.116573,Survey,19/12/21,2021,12,19,AGO,45.632187,2,46.122585,Sub-Saharan Africa,Lower middle income,Angola
AGO,SURVEY,14276033,45.862831,Survey,20/12/21,2021,12,20,AGO,45.632187,2,46.122585,Sub-Saharan Africa,Lower middle income,Angola
AGO,SURVEY,14291981,45.914066,Survey,21/12/21,2021,12,21,AGO,45.632187,2,46.122585,Sub-Saharan Africa,Lower middle income,Angola
AGO,SURVEY,14318652,45.999748,Survey,22/12/21,2021,12,22,AGO,45.632187,2,46.122585,Sub-Saharan Africa,Lower middle income,Angola
AGO,SURVEY,14318198,45.998291,Survey,23/12/21,2021,12,23,AGO,45.632187,2,46.122585,Sub-Saharan Africa,Lower middle income,Angola
AGO,SURVEY,14326736,46.025719,Survey,24/12/21,2021,12,24,AGO,45.632187,2,46.122585,Sub-Saharan Africa,Lower middle income,Angola
AGO,SURVEY,14349963,46.100338,Survey,25/12/21,2021,12,25,AGO,45.632187,2,46.122585,Sub-Saharan Africa,Lower middle income,Angola
AGO,SURVEY,14373158,46.174854,Survey,26/12/21,2021,12,26,AGO,45.632187,2,46.122585,Sub-Saharan Africa,Lower middle income,Angola
AGO,SURVEY,14387099,46.219643,Survey,27/12/21,2021,12,27,AGO,45.632187,2,46.122585,Sub-Saharan Africa,Lower middle income,Angola
AGO,SURVEY,14448638,46.417339,Survey,28/12/21,2021,12,28,AGO,45.632187,2,46.122585,Sub-Saharan Africa,Lower middle income,Angola
AGO,SURVEY,14486154,46.537861,Survey,29/12/21,2021,12,29,AGO,45.632187,2,46.122585,Sub-Saharan Africa,Lower middle income,Angola
AGO,SURVEY,14556496,46.76384,Survey,30/12/21,2021,12,30,AGO,45.632187,2,46.122585,Sub-Saharan Africa,Lower middle income,Angola
AGO,SURVEY,14583627,46.851002,Survey,31/12/21,2021,12,31,AGO,45.632187,2,46.122585,Sub-Saharan Africa,Lower middle income,Angola
AGO,SURVEY,14644197,47.045589,Survey,01/01/22,2022,1,1,AGO,45.970802,1,46.106136,Sub-Saharan Africa,Lower middle income,Angola
AGO,SURVEY,14557000,46.765461,Survey,02/01/22,2022,1,2,AGO,45.970802,1,46.106136,Sub-Saharan Africa,Lower middle income,Angola
AGO,SURVEY,14551975,46.749317,Survey,03/01/22,2022,1,3,AGO,45.970802,1,46.106136,Sub-Saharan Africa,Lower middle income,Angola
AGO,SURVEY,14552967,46.752502,Survey,04/01/22,2022,1,4,AGO,45.970802,1,46.106136,Sub-Saharan Africa,Lower middle income,Angola
AGO,SURVEY,14502048,46.588921,Survey,05/01/22,2022,1,5,AGO,45.970802,1,46.106136,Sub-Saharan Africa,Lower middle income,Angola
AGO,SURVEY,14458575,46.449261,Survey,06/01/22,2022,1,6,AGO,45.970802,1,46.106136,Sub-Saharan Africa,Lower middle income,Angola
AGO,SURVEY,14425045,46.341545,Survey,07/01/22,2022,1,7,AGO,45.970802,1,46.106136,Sub-Saharan Africa,Lower middle income,Angola
AGO,SURVEY,14380039,46.196957,Survey,08/01/22,2022,1,8,AGO,45.970802,1,46.106136,Sub-Saharan Africa,Lower middle income,Angola
AGO,SURVEY,14272199,45.850517,Survey,09/01/22,2022,1,9,AGO,45.970802,1,46.106136,Sub-Saharan Africa,Lower middle income,Angola
AGO,SURVEY,14217783,45.675701,Survey,10/01/22,2022,1,10,AGO,45.970802,1,46.106136,Sub-Saharan Africa,Lower middle income,Angola
AGO,SURVEY,14126231,45.38158,Survey,11/01/22,2022,1,11,AGO,45.970802,1,46.106136,Sub-Saharan Africa,Lower middle income,Angola
AGO,SURVEY,14184508,45.568802,Survey,12/01/22,2022,1,12,AGO,45.970802,1,46.106136,Sub-Saharan Africa,Lower middle income,Angola
AGO,SURVEY,14038228,45.098866,Survey,13/01/22,2022,1,13,AGO,45.970802,1,46.106136,Sub-Saharan Africa,Lower middle income,Angola
AGO,SURVEY,14013962,45.020912,Survey,14/01/22,2022,1,14,AGO,45.970802,1,46.106136,Sub-Saharan Africa,Lower middle income,Angola
AGO,SURVEY,14096522,45.28614,Survey,15/01/22,2022,1,15,AGO,45.970802,2,45.859352,Sub-Saharan Africa,Lower middle income,Angola
AGO,SURVEY,14060740,45.171185,Survey,16/01/22,2022,1,16,AGO,45.970802,2,45.859352,Sub-Saharan Africa,Lower middle income,Angola
AGO,SURVEY,14049480,45.135014,Survey,17/01/22,2022,1,17,AGO,45.970802,2,45.859352,Sub-Saharan Africa,Lower middle income,Angola
AGO,SURVEY,14030939,45.075451,Survey,18/01/22,2022,1,18,AGO,45.970802,2,45.859352,Sub-Saharan Africa,Lower middle income,Angola
AGO,SURVEY,14057758,45.16161,Survey,19/01/22,2022,1,19,AGO,45.970802,2,45.859352,Sub-Saharan Africa,Lower middle income,Angola
AGO,SURVEY,14163842,45.502411,Survey,20/01/22,2022,1,20,AGO,45.970802,2,45.859352,Sub-Saharan Africa,Lower middle income,Angola
AGO,SURVEY,14192491,45.594448,Survey,21/01/22,2022,1,21,AGO,45.970802,2,45.859352,Sub-Saharan Africa,Lower middle income,Angola
AGO,SURVEY,14365025,46.148727,Survey,22/01/22,2022,1,22,AGO,45.970802,2,45.859352,Sub-Saharan Africa,Lower middle income,Angola
AGO,SURVEY,14423371,46.336166,Survey,23/01/22,2022,1,23,AGO,45.970802,2,45.859352,Sub-Saharan Africa,Lower middle income,Angola
AGO,SURVEY,14390580,46.230824,Survey,24/01/22,2022,1,24,AGO,45.970802,2,45.859352,Sub-Saharan Africa,Lower middle income,Angola
AGO,SURVEY,14354634,46.115345,Survey,25/01/22,2022,1,25,AGO,45.970802,2,45.859352,Sub-Saharan Africa,Lower middle income,Angola
AGO,SURVEY,14415816,46.311897,Survey,26/01/22,2022,1,26,AGO,45.970802,2,45.859352,Sub-Saharan Africa,Lower middle income,Angola
AGO,SURVEY,14401692,46.266521,Survey,27/01/22,2022,1,27,AGO,45.970802,2,45.859352,Sub-Saharan Africa,Lower middle income,Angola
AGO,SURVEY,14403979,46.273869,Survey,28/01/22,2022,1,28,AGO,45.970802,2,45.859352,Sub-Saharan Africa,Lower middle income,Angola
AGO,SURVEY,14409727,46.292336,Survey,29/01/22,2022,1,29,AGO,45.970802,2,45.859352,Sub-Saharan Africa,Lower middle income,Angola
AGO,SURVEY,14521053,46.649979,Survey,30/01/22,2022,1,30,AGO,45.970802,2,45.859352,Sub-Saharan Africa,Lower middle income,Angola
AGO,SURVEY,14336492,46.05706,Survey,31/01/22,2022,1,31,AGO,45.970802,2,45.859352,Sub-Saharan Africa,Lower middle income,Angola
AGO,SURVEY,14265602,45.829323,Survey,01/02/22,2022,2,1,AGO,45.862015,1,45.881615,Sub-Saharan Africa,Lower middle income,Angola
AGO,SURVEY,14369393,46.162758,Survey,02/02/22,2022,2,2,AGO,45.862015,1,45.881615,Sub-Saharan Africa,Lower middle income,Angola
AGO,SURVEY,14393805,46.241184,Survey,03/02/22,2022,2,3,AGO,45.862015,1,45.881615,Sub-Saharan Africa,Lower middle income,Angola
AGO,SURVEY,14431443,46.362099,Survey,04/02/22,2022,2,4,AGO,45.862015,1,45.881615,Sub-Saharan Africa,Lower middle income,Angola
AGO,SURVEY,14442282,46.396919,Survey,05/02/22,2022,2,5,AGO,45.862015,1,45.881615,Sub-Saharan Africa,Lower middle income,Angola
AGO,SURVEY,14349032,46.097347,Survey,06/02/22,2022,2,6,AGO,45.862015,1,45.881615,Sub-Saharan Africa,Lower middle income,Angola
AGO,SURVEY,14437843,46.38266,Survey,07/02/22,2022,2,7,AGO,45.862015,1,45.881615,Sub-Saharan Africa,Lower middle income,Angola
AGO,SURVEY,14376368,46.185165,Survey,08/02/22,2022,2,8,AGO,45.862015,1,45.881615,Sub-Saharan Africa,Lower middle income,Angola
AGO,SURVEY,14353559,46.111889,Survey,09/02/22,2022,2,9,AGO,45.862015,1,45.881615,Sub-Saharan Africa,Lower middle income,Angola
AGO,SURVEY,14071813,45.20676,Survey,10/02/22,2022,2,10,AGO,45.862015,1,45.881615,Sub-Saharan Africa,Lower middle income,Angola
AGO,SURVEY,14106519,45.318256,Survey,11/02/22,2022,2,11,AGO,45.862015,1,45.881615,Sub-Saharan Africa,Lower middle income,Angola
AGO,SURVEY,14150955,45.46101,Survey,12/02/22,2022,2,12,AGO,45.862015,1,45.881615,Sub-Saharan Africa,Lower middle income,Angola
AGO,SURVEY,14119789,45.360886,Survey,13/02/22,2022,2,13,AGO,45.862015,1,45.881615,Sub-Saharan Africa,Lower middle income,Angola
AGO,SURVEY,14077916,45.226364,Survey,14/02/22,2022,2,14,AGO,45.862015,1,45.881615,Sub-Saharan Africa,Lower middle income,Angola
AGO,SURVEY,14169858,45.521736,Survey,15/02/22,2022,2,15,AGO,45.862015,2,45.842415,Sub-Saharan Africa,Lower middle income,Angola
AGO,SURVEY,14131371,45.398094,Survey,16/02/22,2022,2,16,AGO,45.862015,2,45.842415,Sub-Saharan Africa,Lower middle income,Angola
AGO,SURVEY,14139922,45.425568,Survey,17/02/22,2022,2,17,AGO,45.862015,2,45.842415,Sub-Saharan Africa,Lower middle income,Angola
AGO,SURVEY,14124773,45.3769,Survey,18/02/22,2022,2,18,AGO,45.862015,2,45.842415,Sub-Saharan Africa,Lower middle income,Angola
AGO,SURVEY,14104613,45.312134,Survey,19/02/22,2022,2,19,AGO,45.862015,2,45.842415,Sub-Saharan Africa,Lower middle income,Angola
AGO,SURVEY,14064380,45.18288,Survey,20/02/22,2022,2,20,AGO,45.862015,2,45.842415,Sub-Saharan Africa,Lower middle income,Angola
AGO,SURVEY,14388992,46.225719,Survey,21/02/22,2022,2,21,AGO,45.862015,2,45.842415,Sub-Saharan Africa,Lower middle income,Angola
AGO,SURVEY,14305159,45.956402,Survey,22/02/22,2022,2,22,AGO,45.862015,2,45.842415,Sub-Saharan Africa,Lower middle income,Angola
AGO,SURVEY,14320792,46.006622,Survey,23/02/22,2022,2,23,AGO,45.862015,2,45.842415,Sub-Saharan Africa,Lower middle income,Angola
AGO,SURVEY,14310653,45.974052,Survey,24/02/22,2022,2,24,AGO,45.862015,2,45.842415,Sub-Saharan Africa,Lower middle income,Angola
AGO,SURVEY,14399737,46.260242,Survey,25/02/22,2022,2,25,AGO,45.862015,2,45.842415,Sub-Saharan Africa,Lower middle income,Angola
AGO,SURVEY,14445348,46.406769,Survey,26/02/22,2022,2,26,AGO,45.862015,2,45.842415,Sub-Saharan Africa,Lower middle income,Angola
AGO,SURVEY,14454925,46.437538,Survey,27/02/22,2022,2,27,AGO,45.862015,2,45.842415,Sub-Saharan Africa,Lower middle income,Angola
AGO,SURVEY,14414969,46.309177,Survey,28/02/22,2022,2,28,AGO,45.862015,2,45.842415,Sub-Saharan Africa,Lower middle income,Angola
AGO,SURVEY,14426968,46.347721,Survey,01/03/22,2022,3,1,AGO,44.678509,1,45.815651,Sub-Saharan Africa,Lower middle income,Angola
AGO,SURVEY,14450858,46.424473,Survey,02/03/22,2022,3,2,AGO,44.678509,1,45.815651,Sub-Saharan Africa,Lower middle income,Angola
AGO,SURVEY,14405060,46.27734,Survey,03/03/22,2022,3,3,AGO,44.678509,1,45.815651,Sub-Saharan Africa,Lower middle income,Angola
AGO,SURVEY,14332288,46.043556,Survey,04/03/22,2022,3,4,AGO,44.678509,1,45.815651,Sub-Saharan Africa,Lower middle income,Angola
AGO,SURVEY,14328681,46.031967,Survey,05/03/22,2022,3,5,AGO,44.678509,1,45.815651,Sub-Saharan Africa,Lower middle income,Angola
AGO,SURVEY,14401384,46.265533,Survey,06/03/22,2022,3,6,AGO,44.678509,1,45.815651,Sub-Saharan Africa,Lower middle income,Angola
AGO,SURVEY,14358744,46.128548,Survey,07/03/22,2022,3,7,AGO,44.678509,1,45.815651,Sub-Saharan Africa,Lower middle income,Angola
AGO,SURVEY,14237327,45.738487,Survey,08/03/22,2022,3,8,AGO,44.678509,1,45.815651,Sub-Saharan Africa,Lower middle income,Angola
AGO,SURVEY,14181220,45.558239,Survey,09/03/22,2022,3,9,AGO,44.678509,1,45.815651,Sub-Saharan Africa,Lower middle income,Angola
AGO,SURVEY,14223089,45.692745,Survey,10/03/22,2022,3,10,AGO,44.678509,1,45.815651,Sub-Saharan Africa,Lower middle income,Angola
AGO,SURVEY,14180316,45.555336,Survey,11/03/22,2022,3,11,AGO,44.678509,1,45.815651,Sub-Saharan Africa,Lower middle income,Angola
AGO,SURVEY,14150721,45.460258,Survey,12/03/22,2022,3,12,AGO,44.678509,1,45.815651,Sub-Saharan Africa,Lower middle income,Angola
AGO,SURVEY,14017877,45.033489,Survey,13/03/22,2022,3,13,AGO,44.678509,1,45.815651,Sub-Saharan Africa,Lower middle income,Angola
AGO,SURVEY,13964320,44.861431,Survey,14/03/22,2022,3,14,AGO,44.678509,1,45.815651,Sub-Saharan Africa,Lower middle income,Angola
AGO,SURVEY,13950578,44.817284,Survey,15/03/22,2022,3,15,AGO,44.678509,2,43.742039,Sub-Saharan Africa,Lower middle income,Angola
AGO,SURVEY,13934697,44.766266,Survey,16/03/22,2022,3,16,AGO,44.678509,2,43.742039,Sub-Saharan Africa,Lower middle income,Angola
AGO,SURVEY,13841789,44.467793,Survey,17/03/22,2022,3,17,AGO,44.678509,2,43.742039,Sub-Saharan Africa,Lower middle income,Angola
AGO,SURVEY,13708934,44.040985,Survey,18/03/22,2022,3,18,AGO,44.678509,2,43.742039,Sub-Saharan Africa,Lower middle income,Angola
AGO,SURVEY,13735658,44.126839,Survey,19/03/22,2022,3,19,AGO,44.678509,2,43.742039,Sub-Saharan Africa,Lower middle income,Angola
AGO,SURVEY,13853527,44.505501,Survey,20/03/22,2022,3,20,AGO,44.678509,2,43.742039,Sub-Saharan Africa,Lower middle income,Angola
AGO,SURVEY,13858870,44.522667,Survey,21/03/22,2022,3,21,AGO,44.678509,2,43.742039,Sub-Saharan Africa,Lower middle income,Angola
AGO,SURVEY,13690736,43.982521,Survey,22/03/22,2022,3,22,AGO,44.678509,2,43.742039,Sub-Saharan Africa,Lower middle income,Angola
AGO,SURVEY,13678284,43.94252,Survey,23/03/22,2022,3,23,AGO,44.678509,2,43.742039,Sub-Saharan Africa,Lower middle income,Angola
AGO,SURVEY,13688807,43.976326,Survey,24/03/22,2022,3,24,AGO,44.678509,2,43.742039,Sub-Saharan Africa,Lower middle income,Angola
AGO,SURVEY,13631403,43.791908,Survey,25/03/22,2022,3,25,AGO,44.678509,2,43.742039,Sub-Saharan Africa,Lower middle income,Angola
AGO,SURVEY,13613093,43.733086,Survey,26/03/22,2022,3,26,AGO,44.678509,2,43.742039,Sub-Saharan Africa,Lower middle income,Angola
AGO,SURVEY,13435969,43.164066,Survey,27/03/22,2022,3,27,AGO,44.678509,2,43.742039,Sub-Saharan Africa,Lower middle income,Angola
AGO,SURVEY,13332223,42.830772,Survey,28/03/22,2022,3,28,AGO,44.678509,2,43.742039,Sub-Saharan Africa,Lower middle income,Angola
AGO,SURVEY,13248722,42.562519,Survey,29/03/22,2022,3,29,AGO,44.678509,2,43.742039,Sub-Saharan Africa,Lower middle income,Angola
AGO,SURVEY,13144435,42.227489,Survey,30/03/22,2022,3,30,AGO,44.678509,2,43.742039,Sub-Saharan Africa,Lower middle income,Angola
AGO,SURVEY,13122211,42.15609,Survey,31/03/22,2022,3,31,AGO,44.678509,2,43.742039,Sub-Saharan Africa,Lower middle income,Angola
AGO,SURVEY,13097068,42.075317,Survey,01/04/22,2022,4,1,AGO,41.267929,1,42.008511,Sub-Saharan Africa,Lower middle income,Angola
AGO,SURVEY,13045656,41.910152,Survey,02/04/22,2022,4,2,AGO,41.267929,1,42.008511,Sub-Saharan Africa,Lower middle income,Angola
AGO,SURVEY,13016541,41.81662,Survey,03/04/22,2022,4,3,AGO,41.267929,1,42.008511,Sub-Saharan Africa,Lower middle income,Angola
AGO,SURVEY,13076499,42.009239,Survey,04/04/22,2022,4,4,AGO,41.267929,1,42.008511,Sub-Saharan Africa,Lower middle income,Angola
AGO,SURVEY,13056124,41.943783,Survey,05/04/22,2022,4,5,AGO,41.267929,1,42.008511,Sub-Saharan Africa,Lower middle income,Angola
AGO,SURVEY,13010727,41.797943,Survey,06/04/22,2022,4,6,AGO,41.267929,1,42.008511,Sub-Saharan Africa,Lower middle income,Angola
AGO,SURVEY,13075819,42.007057,Survey,07/04/22,2022,4,7,AGO,41.267929,1,42.008511,Sub-Saharan Africa,Lower middle income,Angola
AGO,SURVEY,13161200,42.281349,Survey,08/04/22,2022,4,8,AGO,41.267929,1,42.008511,Sub-Saharan Africa,Lower middle income,Angola
AGO,SURVEY,13131705,42.186592,Survey,09/04/22,2022,4,9,AGO,41.267929,1,42.008511,Sub-Saharan Africa,Lower middle income,Angola
AGO,SURVEY,13246780,42.556278,Survey,10/04/22,2022,4,10,AGO,41.267929,1,42.008511,Sub-Saharan Africa,Lower middle income,Angola
AGO,SURVEY,13110864,42.11964,Survey,11/04/22,2022,4,11,AGO,41.267929,1,42.008511,Sub-Saharan Africa,Lower middle income,Angola
AGO,SURVEY,12946465,41.591492,Survey,12/04/22,2022,4,12,AGO,41.267929,1,42.008511,Sub-Saharan Africa,Lower middle income,Angola
AGO,SURVEY,13068252,41.982746,Survey,13/04/22,2022,4,13,AGO,41.267929,1,42.008511,Sub-Saharan Africa,Lower middle income,Angola
AGO,SURVEY,13024110,41.840935,Survey,14/04/22,2022,4,14,AGO,41.267929,1,42.008511,Sub-Saharan Africa,Lower middle income,Angola
AGO,SURVEY,12983627,41.71088,Survey,15/04/22,2022,4,15,AGO,41.267929,2,40.619923,Sub-Saharan Africa,Lower middle income,Angola
AGO,SURVEY,12886871,41.400043,Survey,16/04/22,2022,4,16,AGO,41.267929,2,40.619923,Sub-Saharan Africa,Lower middle income,Angola
AGO,SURVEY,12851212,41.285488,Survey,17/04/22,2022,4,17,AGO,41.267929,2,40.619923,Sub-Saharan Africa,Lower middle income,Angola
AGO,SURVEY,12783737,41.068718,Survey,18/04/22,2022,4,18,AGO,41.267929,2,40.619923,Sub-Saharan Africa,Lower middle income,Angola
AGO,SURVEY,12779498,41.055099,Survey,19/04/22,2022,4,19,AGO,41.267929,2,40.619923,Sub-Saharan Africa,Lower middle income,Angola
AGO,SURVEY,12763009,41.002129,Survey,20/04/22,2022,4,20,AGO,41.267929,2,40.619923,Sub-Saharan Africa,Lower middle income,Angola
AGO,SURVEY,12661923,40.677383,Survey,21/04/22,2022,4,21,AGO,41.267929,2,40.619923,Sub-Saharan Africa,Lower middle income,Angola
AGO,SURVEY,12500329,40.158253,Survey,22/04/22,2022,4,22,AGO,41.267929,2,40.619923,Sub-Saharan Africa,Lower middle income,Angola
AGO,SURVEY,12528232,40.24789,Survey,23/04/22,2022,4,23,AGO,41.267929,2,40.619923,Sub-Saharan Africa,Lower middle income,Angola
AGO,SURVEY,12527546,40.245686,Survey,24/04/22,2022,4,24,AGO,41.267929,2,40.619923,Sub-Saharan Africa,Lower middle income,Angola
AGO,SURVEY,12540934,40.2887,Survey,25/04/22,2022,4,25,AGO,41.267929,2,40.619923,Sub-Saharan Africa,Lower middle income,Angola
AGO,SURVEY,12512994,40.198936,Survey,26/04/22,2022,4,26,AGO,41.267929,2,40.619923,Sub-Saharan Africa,Lower middle income,Angola
AGO,SURVEY,12485492,40.110584,Survey,27/04/22,2022,4,27,AGO,41.267929,2,40.619923,Sub-Saharan Africa,Lower middle income,Angola
AGO,SURVEY,12517932,40.214802,Survey,28/04/22,2022,4,28,AGO,41.267929,2,40.619923,Sub-Saharan Africa,Lower middle income,Angola
AGO,SURVEY,12498062,40.150967,Survey,29/04/22,2022,4,29,AGO,41.267929,2,40.619923,Sub-Saharan Africa,Lower middle income,Angola
AGO,SURVEY,12483197,40.10321,Survey,30/04/22,2022,4,30,AGO,41.267929,2,40.619923,Sub-Saharan Africa,Lower middle income,Angola
AGO,SURVEY,12522325,40.228912,Survey,01/05/22,2022,5,1,AGO,37.810627,1,39.392929,Sub-Saharan Africa,Lower middle income,Angola
AGO,SURVEY,12434122,39.945557,Survey,02/05/22,2022,5,2,AGO,37.810627,1,39.392929,Sub-Saharan Africa,Lower middle income,Angola
AGO,SURVEY,12429259,39.929932,Survey,03/05/22,2022,5,3,AGO,37.810627,1,39.392929,Sub-Saharan Africa,Lower middle income,Angola
AGO,SURVEY,12446187,39.984314,Survey,04/05/22,2022,5,4,AGO,37.810627,1,39.392929,Sub-Saharan Africa,Lower middle income,Angola
AGO,SURVEY,12443041,39.974205,Survey,05/05/22,2022,5,5,AGO,37.810627,1,39.392929,Sub-Saharan Africa,Lower middle income,Angola
AGO,SURVEY,12314082,39.559917,Survey,06/05/22,2022,5,6,AGO,37.810627,1,39.392929,Sub-Saharan Africa,Lower middle income,Angola
AGO,SURVEY,12422745,39.909004,Survey,07/05/22,2022,5,7,AGO,37.810627,1,39.392929,Sub-Saharan Africa,Lower middle income,Angola
AGO,SURVEY,12356505,39.696205,Survey,08/05/22,2022,5,8,AGO,37.810627,1,39.392929,Sub-Saharan Africa,Lower middle income,Angola
AGO,SURVEY,12380208,39.772354,Survey,09/05/22,2022,5,9,AGO,37.810627,1,39.392929,Sub-Saharan Africa,Lower middle income,Angola
AGO,SURVEY,12360152,39.707916,Survey,10/05/22,2022,5,10,AGO,37.810627,1,39.392929,Sub-Saharan Africa,Lower middle income,Angola
AGO,SURVEY,12160796,39.067474,Survey,11/05/22,2022,5,11,AGO,37.810627,1,39.392929,Sub-Saharan Africa,Lower middle income,Angola
AGO,SURVEY,11945427,38.375587,Survey,12/05/22,2022,5,12,AGO,37.810627,1,39.392929,Sub-Saharan Africa,Lower middle income,Angola
AGO,SURVEY,11734625,37.698368,Survey,13/05/22,2022,5,13,AGO,37.810627,1,39.392929,Sub-Saharan Africa,Lower middle income,Angola
AGO,SURVEY,11719957,37.651245,Survey,14/05/22,2022,5,14,AGO,37.810627,1,39.392929,Sub-Saharan Africa,Lower middle income,Angola
AGO,SURVEY,11738642,37.711273,Survey,15/05/22,2022,5,15,AGO,37.810627,2,36.507553,Sub-Saharan Africa,Lower middle income,Angola
AGO,SURVEY,11738560,37.71101,Survey,16/05/22,2022,5,16,AGO,37.810627,2,36.507553,Sub-Saharan Africa,Lower middle income,Angola
AGO,SURVEY,11652995,37.436123,Survey,17/05/22,2022,5,17,AGO,37.810627,2,36.507553,Sub-Saharan Africa,Lower middle income,Angola
AGO,SURVEY,11610513,37.299648,Survey,18/05/22,2022,5,18,AGO,37.810627,2,36.507553,Sub-Saharan Africa,Lower middle income,Angola
AGO,SURVEY,11639169,37.391708,Survey,19/05/22,2022,5,19,AGO,37.810627,2,36.507553,Sub-Saharan Africa,Lower middle income,Angola
AGO,SURVEY,11632699,37.370922,Survey,20/05/22,2022,5,20,AGO,37.810627,2,36.507553,Sub-Saharan Africa,Lower middle income,Angola
AGO,SURVEY,11509857,36.976284,Survey,21/05/22,2022,5,21,AGO,37.810627,2,36.507553,Sub-Saharan Africa,Lower middle income,Angola
AGO,SURVEY,11142903,35.797417,Survey,22/05/22,2022,5,22,AGO,37.810627,2,36.507553,Sub-Saharan Africa,Lower middle income,Angola
AGO,SURVEY,11195278,35.965675,Survey,23/05/22,2022,5,23,AGO,37.810627,2,36.507553,Sub-Saharan Africa,Lower middle income,Angola
AGO,SURVEY,11251785,36.147205,Survey,24/05/22,2022,5,24,AGO,37.810627,2,36.507553,Sub-Saharan Africa,Lower middle income,Angola
AGO,SURVEY,11219392,36.043144,Survey,25/05/22,2022,5,25,AGO,37.810627,2,36.507553,Sub-Saharan Africa,Lower middle income,Angola
AGO,SURVEY,11166575,35.873463,Survey,26/05/22,2022,5,26,AGO,37.810627,2,36.507553,Sub-Saharan Africa,Lower middle income,Angola
AGO,SURVEY,11200529,35.982544,Survey,27/05/22,2022,5,27,AGO,37.810627,2,36.507553,Sub-Saharan Africa,Lower middle income,Angola
AGO,SURVEY,11107794,35.684624,Survey,28/05/22,2022,5,28,AGO,37.810627,2,36.507553,Sub-Saharan Africa,Lower middle income,Angola
AGO,SURVEY,11165348,35.869522,Survey,29/05/22,2022,5,29,AGO,37.810627,2,36.507553,Sub-Saharan Africa,Lower middle income,Angola
AGO,SURVEY,11128394,35.750805,Survey,30/05/22,2022,5,30,AGO,37.810627,2,36.507553,Sub-Saharan Africa,Lower middle income,Angola
AGO,SURVEY,11086759,35.61705,Survey,31/05/22,2022,5,31,AGO,37.810627,2,36.507553,Sub-Saharan Africa,Lower middle income,Angola
AGO,SURVEY,11170631,35.886494,Survey,01/06/22,2022,6,1,AGO,34.847054,1,35.327927,Sub-Saharan Africa,Lower middle income,Angola
AGO,SURVEY,11193186,35.958954,Survey,02/06/22,2022,6,2,AGO,34.847054,1,35.327927,Sub-Saharan Africa,Lower middle income,Angola
AGO,SURVEY,11191983,35.95509,Survey,03/06/22,2022,6,3,AGO,34.847054,1,35.327927,Sub-Saharan Africa,Lower middle income,Angola
AGO,SURVEY,11061809,35.536896,Survey,04/06/22,2022,6,4,AGO,34.847054,1,35.327927,Sub-Saharan Africa,Lower middle income,Angola
AGO,SURVEY,11041441,35.471462,Survey,05/06/22,2022,6,5,AGO,34.847054,1,35.327927,Sub-Saharan Africa,Lower middle income,Angola
AGO,SURVEY,11067075,35.553814,Survey,06/06/22,2022,6,6,AGO,34.847054,1,35.327927,Sub-Saharan Africa,Lower middle income,Angola
AGO,SURVEY,10885375,34.970085,Survey,07/06/22,2022,6,7,AGO,34.847054,1,35.327927,Sub-Saharan Africa,Lower middle income,Angola
AGO,SURVEY,10887150,34.975792,Survey,08/06/22,2022,6,8,AGO,34.847054,1,35.327927,Sub-Saharan Africa,Lower middle income,Angola
AGO,SURVEY,10918707,35.077171,Survey,09/06/22,2022,6,9,AGO,34.847054,1,35.327927,Sub-Saharan Africa,Lower middle income,Angola
AGO,SURVEY,10810576,34.72979,Survey,10/06/22,2022,6,10,AGO,34.847054,1,35.327927,Sub-Saharan Africa,Lower middle income,Angola
AGO,SURVEY,10869408,34.918793,Survey,11/06/22,2022,6,11,AGO,34.847054,1,35.327927,Sub-Saharan Africa,Lower middle income,Angola
AGO,SURVEY,10933857,35.125839,Survey,12/06/22,2022,6,12,AGO,34.847054,1,35.327927,Sub-Saharan Africa,Lower middle income,Angola
AGO,SURVEY,11000172,35.338882,Survey,13/06/22,2022,6,13,AGO,34.847054,1,35.327927,Sub-Saharan Africa,Lower middle income,Angola
AGO,SURVEY,10923301,35.091927,Survey,14/06/22,2022,6,14,AGO,34.847054,1,35.327927,Sub-Saharan Africa,Lower middle income,Angola
AGO,SURVEY,10929914,35.113174,Survey,15/06/22,2022,6,15,AGO,34.847054,2,34.426292,Sub-Saharan Africa,Lower middle income,Angola
AGO,SURVEY,10912631,35.057648,Survey,16/06/22,2022,6,16,AGO,34.847054,2,34.426292,Sub-Saharan Africa,Lower middle income,Angola
AGO,SURVEY,10822212,34.76717,Survey,17/06/22,2022,6,17,AGO,34.847054,2,34.426292,Sub-Saharan Africa,Lower middle income,Angola
AGO,SURVEY,10707615,34.399021,Survey,18/06/22,2022,6,18,AGO,34.847054,2,34.426292,Sub-Saharan Africa,Lower middle income,Angola
AGO,SURVEY,10690108,34.342777,Survey,19/06/22,2022,6,19,AGO,34.847054,2,34.426292,Sub-Saharan Africa,Lower middle income,Angola
AGO,SURVEY,10650576,34.215778,Survey,20/06/22,2022,6,20,AGO,34.847054,2,34.426292,Sub-Saharan Africa,Lower middle income,Angola
AGO,SURVEY,10627129,34.140453,Survey,21/06/22,2022,6,21,AGO,34.847054,2,34.426292,Sub-Saharan Africa,Lower middle income,Angola
AGO,SURVEY,10584871,34.004696,Survey,22/06/22,2022,6,22,AGO,34.847054,2,34.426292,Sub-Saharan Africa,Lower middle income,Angola
AGO,SURVEY,10562880,33.934048,Survey,23/06/22,2022,6,23,AGO,34.847054,2,34.426292,Sub-Saharan Africa,Lower middle income,Angola
AGO,SURVEY,10538140,33.854568,Survey,24/06/22,2022,6,24,AGO,34.847054,2,34.426292,Sub-Saharan Africa,Lower middle income,Angola
AGO,SURVEY,10723479,34.449986,Survey,25/06/22,2022,6,25,AGO,34.847054,2,34.426292,Sub-Saharan Africa,Lower middle income,Angola
AGO,SURVEY,10594026,34.034107,Survey,26/06/22,2022,6,26,AGO,34.847054,2,34.426292,Sub-Saharan Africa,Lower middle income,Angola
AGO,SURVEY,10783795,34.643753,Survey,27/06/22,2022,6,27,AGO,34.847054,2,34.426292,Sub-Saharan Africa,Lower middle income,Angola
AGO,SURVEY,10754178,34.548607,Survey,28/06/22,2022,6,28,AGO,34.847054,2,34.426292,Sub-Saharan Africa,Lower middle income,Angola
AGO,SURVEY,10788989,34.660442,Survey,29/06/22,2022,6,29,AGO,34.847054,2,34.426292,Sub-Saharan Africa,Lower middle income,Angola
AGO,SURVEY,10787115,34.654419,Survey,30/06/22,2022,6,30,AGO,34.847054,2,34.426292,Sub-Saharan Africa,Lower middle income,Angola
AGO,SURVEY,10678589,34.305771,Survey,01/07/22,2022,7,1,AGO,34.7915,1,34.541824,Sub-Saharan Africa,Lower middle income,Angola
AGO,SURVEY,10804564,34.710476,Survey,02/07/22,2022,7,2,AGO,34.7915,1,34.541824,Sub-Saharan Africa,Lower middle income,Angola
AGO,SURVEY,10750881,34.538017,Survey,03/07/22,2022,7,3,AGO,34.7915,1,34.541824,Sub-Saharan Africa,Lower middle income,Angola
AGO,SURVEY,10738648,34.498714,Survey,04/07/22,2022,7,4,AGO,34.7915,1,34.541824,Sub-Saharan Africa,Lower middle income,Angola
AGO,SURVEY,10761176,34.571091,Survey,05/07/22,2022,7,5,AGO,34.7915,1,34.541824,Sub-Saharan Africa,Lower middle income,Angola
AGO,SURVEY,10707630,34.399067,Survey,06/07/22,2022,7,6,AGO,34.7915,1,34.541824,Sub-Saharan Africa,Lower middle income,Angola
AGO,SURVEY,10652654,34.222454,Survey,07/07/22,2022,7,7,AGO,34.7915,1,34.541824,Sub-Saharan Africa,Lower middle income,Angola
AGO,SURVEY,10719124,34.435993,Survey,08/07/22,2022,7,8,AGO,34.7915,1,34.541824,Sub-Saharan Africa,Lower middle income,Angola
AGO,SURVEY,10636591,34.170853,Survey,09/07/22,2022,7,9,AGO,34.7915,1,34.541824,Sub-Saharan Africa,Lower middle income,Angola
AGO,SURVEY,10722890,34.448093,Survey,10/07/22,2022,7,10,AGO,34.7915,1,34.541824,Sub-Saharan Africa,Lower middle income,Angola
AGO,SURVEY,10771551,34.60442,Survey,11/07/22,2022,7,11,AGO,34.7915,1,34.541824,Sub-Saharan Africa,Lower middle income,Angola
AGO,SURVEY,10764327,34.581211,Survey,12/07/22,2022,7,12,AGO,34.7915,1,34.541824,Sub-Saharan Africa,Lower middle income,Angola
AGO,SURVEY,10773133,34.609501,Survey,13/07/22,2022,7,13,AGO,34.7915,1,34.541824,Sub-Saharan Africa,Lower middle income,Angola
AGO,SURVEY,11047170,35.489864,Survey,14/07/22,2022,7,14,AGO,34.7915,1,34.541824,Sub-Saharan Africa,Lower middle income,Angola
AGO,SURVEY,11096292,35.647675,Survey,15/07/22,2022,7,15,AGO,34.7915,2,35.956665,Sub-Saharan Africa,Lower middle income,Angola
AGO,SURVEY,11202142,35.987724,Survey,16/07/22,2022,7,16,AGO,34.7915,2,35.956665,Sub-Saharan Africa,Lower middle income,Angola
AGO,SURVEY,11278988,36.2346,Survey,17/07/22,2022,7,17,AGO,34.7915,2,35.956665,Sub-Saharan Africa,Lower middle income,Angola
ARM,PREDICTION,,,Predicted,13/06/21,2021,6,13,ARM,,1,,Europe & Central Asia,Upper middle income,Armenia
ARM,PREDICTION,,,Predicted,14/06/21,2021,6,14,ARM,,1,,Europe & Central Asia,Upper middle income,Armenia
ARM,PREDICTION,,,Predicted,15/06/21,2021,6,15,ARM,,2,,Europe & Central Asia,Upper middle income,Armenia
ARM,PREDICTION,,,Predicted,16/06/21,2021,6,16,ARM,,2,,Europe & Central Asia,Upper middle income,Armenia
ARM,PREDICTION,,,Predicted,17/06/21,2021,6,17,ARM,,2,,Europe & Central Asia,Upper middle income,Armenia
ARM,PREDICTION,,,Predicted,18/06/21,2021,6,18,ARM,,2,,Europe & Central Asia,Upper middle income,Armenia
ARM,PREDICTION,,,Predicted,19/06/21,2021,6,19,ARM,,2,,Europe & Central Asia,Upper middle income,Armenia
ARM,PREDICTION,,,Predicted,20/06/21,2021,6,20,ARM,,2,,Europe & Central Asia,Upper middle income,Armenia
ARM,PREDICTION,,,Predicted,21/06/21,2021,6,21,ARM,,2,,Europe & Central Asia,Upper middle income,Armenia
ARM,PREDICTION,,,Predicted,22/06/21,2021,6,22,ARM,,2,,Europe & Central Asia,Upper middle income,Armenia
ARM,PREDICTION,,,Predicted,23/06/21,2021,6,23,ARM,,2,,Europe & Central Asia,Upper middle income,Armenia
ARM,PREDICTION,,,Predicted,24/06/21,2021,6,24,ARM,,2,,Europe & Central Asia,Upper middle income,Armenia
ARM,PREDICTION,,,Predicted,25/06/21,2021,6,25,ARM,,2,,Europe & Central Asia,Upper middle income,Armenia
ARM,PREDICTION,,,Predicted,26/06/21,2021,6,26,ARM,,2,,Europe & Central Asia,Upper middle income,Armenia
ARM,PREDICTION,,,Predicted,27/06/21,2021,6,27,ARM,,2,,Europe & Central Asia,Upper middle income,Armenia
ARM,PREDICTION,,,Predicted,28/06/21,2021,6,28,ARM,,2,,Europe & Central Asia,Upper middle income,Armenia
ARM,PREDICTION,,,Predicted,29/06/21,2021,6,29,ARM,,2,,Europe & Central Asia,Upper middle income,Armenia
ARM,PREDICTION,,,Predicted,30/06/21,2021,6,30,ARM,,2,,Europe & Central Asia,Upper middle income,Armenia
ARM,PREDICTION,,,Predicted,01/07/21,2021,7,1,ARM,,1,,Europe & Central Asia,Upper middle income,Armenia
ARM,PREDICTION,,,Predicted,02/07/21,2021,7,2,ARM,,1,,Europe & Central Asia,Upper middle income,Armenia
ARM,PREDICTION,,,Predicted,03/07/21,2021,7,3,ARM,,1,,Europe & Central Asia,Upper middle income,Armenia
ARM,PREDICTION,,,Predicted,04/07/21,2021,7,4,ARM,,1,,Europe & Central Asia,Upper middle income,Armenia
ARM,PREDICTION,,,Predicted,05/07/21,2021,7,5,ARM,,1,,Europe & Central Asia,Upper middle income,Armenia
ARM,PREDICTION,,,Predicted,06/07/21,2021,7,6,ARM,,1,,Europe & Central Asia,Upper middle income,Armenia
ARM,PREDICTION,,,Predicted,07/07/21,2021,7,7,ARM,,1,,Europe & Central Asia,Upper middle income,Armenia
ARM,PREDICTION,,,Predicted,08/07/21,2021,7,8,ARM,,1,,Europe & Central Asia,Upper middle income,Armenia
